2048_batch_out.gemm.csv
Problem,Provider,OperationKind,Operation,Disposition,Status,gemm_kind,split_k_mode,m,n,k,A,B,C,alpha,beta,split_k_slices,batch_count,op_class,accum,cta_m,cta_n,cta_k,cluster_m,cluster_n,cluster_k,stages,warps_m,warps_n,warps_k,inst_m,inst_n,inst_k,min_cc,max_cc,Bytes,Flops,Flops/Byte,Runtime,GB/s,GFLOPs
1,CUTLASS,gemm,cutlass_tensorop_s884gemm_f16_256x128_32x2_nn_align8,passed,success,universal,serial,2048,2048,2048,f16:column,f16:column,f32:column,1,0,1,1,tensorop,f32,256,128,32,1,1,1,2,4,2,1,16,16,4,70,75,33554432,17188257792,512,0.230492,135.579,74572
1,CUTLASS,gemm,cutlass_tensorop_s884gemm_f16_256x128_32x2_nt_align8,passed,success,universal,serial,2048,2048,2048,f16:column,f16:row,f32:column,1,0,1,1,tensorop,f32,256,128,32,1,1,1,2,4,2,1,16,16,4,70,75,33554432,17188257792,512,0.232202,134.581,74022.8
1,CUTLASS,gemm,cutlass_tensorop_s884gemm_f16_256x128_32x2_tn_align8,passed,success,universal,serial,2048,2048,2048,f16:row,f16:column,f32:column,1,0,1,1,tensorop,f32,256,128,32,1,1,1,2,4,2,1,16,16,4,70,75,33554432,17188257792,512,0.240824,129.763,71372.6
1,CUTLASS,gemm,cutlass_tensorop_s884gemm_f16_256x128_32x2_tt_align8,passed,success,universal,serial,2048,2048,2048,f16:row,f16:row,f32:column,1,0,1,1,tensorop,f32,256,128,32,1,1,1,2,4,2,1,16,16,4,70,75,33554432,17188257792,512,0.226888,137.733,75756.7
1,CUTLASS,gemm,cutlass_tensorop_f16_s884gemm_f16_256x128_32x2_nn_align8,passed,success,universal,serial,2048,2048,2048,f16:column,f16:column,f16:column,1,0,1,1,tensorop,f32,256,128,32,1,1,1,2,4,2,1,16,16,4,70,75,25165824,17188257792,683,0.225311,104.023,76286.9
1,CUTLASS,gemm,cutlass_tensorop_f16_s884gemm_f16_256x128_32x2_nt_align8,passed,success,universal,serial,2048,2048,2048,f16:column,f16:row,f16:column,1,0,1,1,tensorop,f32,256,128,32,1,1,1,2,4,2,1,16,16,4,70,75,25165824,17188257792,683,0.227564,102.993,75531.7
1,CUTLASS,gemm,cutlass_tensorop_f16_s884gemm_f16_256x128_32x2_tn_align8,passed,success,universal,serial,2048,2048,2048,f16:row,f16:column,f16:column,1,0,1,1,tensorop,f32,256,128,32,1,1,1,2,4,2,1,16,16,4,70,75,25165824,17188257792,683,0.227809,102.882,75450.2
1,CUTLASS,gemm,cutlass_tensorop_f16_s884gemm_f16_256x128_32x2_tt_align8,passed,success,universal,serial,2048,2048,2048,f16:row,f16:row,f16:column,1,0,1,1,tensorop,f32,256,128,32,1,1,1,2,4,2,1,16,16,4,70,75,25165824,17188257792,683,0.220436,106.323,77973.7
2,CUTLASS,gemm,cutlass_tensorop_s884gemm_f16_256x128_32x2_nn_align8,passed,success,universal,serial,2048,2048,2048,f16:column,f16:column,f32:column,1,0,1,2,tensorop,f32,256,128,32,1,1,1,2,4,2,1,16,16,4,70,75,67108864,34376515584,512,0.460431,135.742,74661.5
2,CUTLASS,gemm,cutlass_tensorop_s884gemm_f16_256x128_32x2_nt_align8,passed,success,universal,serial,2048,2048,2048,f16:column,f16:row,f32:column,1,0,1,2,tensorop,f32,256,128,32,1,1,1,2,4,2,1,16,16,4,70,75,67108864,34376515584,512,0.461373,135.465,74509.1
2,CUTLASS,gemm,cutlass_tensorop_s884gemm_f16_256x128_32x2_tn_align8,passed,success,universal,serial,2048,2048,2048,f16:row,f16:column,f32:column,1,0,1,2,tensorop,f32,256,128,32,1,1,1,2,4,2,1,16,16,4,70,75,67108864,34376515584,512,0.48,130.208,71617.7
2,CUTLASS,gemm,cutlass_tensorop_s884gemm_f16_256x128_32x2_tt_align8,passed,success,universal,serial,2048,2048,2048,f16:row,f16:row,f32:column,1,0,1,2,tensorop,f32,256,128,32,1,1,1,2,4,2,1,16,16,4,70,75,67108864,34376515584,512,0.454502,137.513,75635.5
2,CUTLASS,gemm,cutlass_tensorop_f16_s884gemm_f16_256x128_32x2_nn_align8,passed,success,universal,serial,2048,2048,2048,f16:column,f16:column,f16:column,1,0,1,2,tensorop,f32,256,128,32,1,1,1,2,4,2,1,16,16,4,70,75,50331648,34376515584,683,0.447785,104.682,76770.1
2,CUTLASS,gemm,cutlass_tensorop_f16_s884gemm_f16_256x128_32x2_nt_align8,passed,success,universal,serial,2048,2048,2048,f16:column,f16:row,f16:column,1,0,1,2,tensorop,f32,256,128,32,1,1,1,2,4,2,1,16,16,4,70,75,50331648,34376515584,683,0.450765,103.99,76262.6
2,CUTLASS,gemm,cutlass_tensorop_f16_s884gemm_f16_256x128_32x2_tn_align8,passed,success,universal,serial,2048,2048,2048,f16:row,f16:column,f16:column,1,0,1,2,tensorop,f32,256,128,32,1,1,1,2,4,2,1,16,16,4,70,75,50331648,34376515584,683,0.456847,102.605,75247.3
2,CUTLASS,gemm,cutlass_tensorop_f16_s884gemm_f16_256x128_32x2_tt_align8,passed,success,universal,serial,2048,2048,2048,f16:row,f16:row,f16:column,1,0,1,2,tensorop,f32,256,128,32,1,1,1,2,4,2,1,16,16,4,70,75,50331648,34376515584,683,0.441395,106.197,77881.5
3,CUTLASS,gemm,cutlass_tensorop_s884gemm_f16_256x128_32x2_nn_align8,passed,success,universal,serial,2048,2048,2048,f16:column,f16:column,f32:column,1,0,1,4,tensorop,f32,256,128,32,1,1,1,2,4,2,1,16,16,4,70,75,134217728,68753031168,512,0.813107,153.731,84555.9
3,CUTLASS,gemm,cutlass_tensorop_s884gemm_f16_256x128_32x2_nt_align8,passed,success,universal,serial,2048,2048,2048,f16:column,f16:row,f32:column,1,0,1,4,tensorop,f32,256,128,32,1,1,1,2,4,2,1,16,16,4,70,75,134217728,68753031168,512,0.810701,154.188,84806.9
3,CUTLASS,gemm,cutlass_tensorop_s884gemm_f16_256x128_32x2_tn_align8,passed,success,universal,serial,2048,2048,2048,f16:row,f16:column,f32:column,1,0,1,4,tensorop,f32,256,128,32,1,1,1,2,4,2,1,16,16,4,70,75,134217728,68753031168,512,0.844237,148.063,81438.1
3,CUTLASS,gemm,cutlass_tensorop_s884gemm_f16_256x128_32x2_tt_align8,passed,success,universal,serial,2048,2048,2048,f16:row,f16:row,f32:column,1,0,1,4,tensorop,f32,256,128,32,1,1,1,2,4,2,1,16,16,4,70,75,134217728,68753031168,512,0.796887,156.86,86277
3,CUTLASS,gemm,cutlass_tensorop_f16_s884gemm_f16_256x128_32x2_nn_align8,passed,success,universal,serial,2048,2048,2048,f16:column,f16:column,f16:column,1,0,1,4,tensorop,f32,256,128,32,1,1,1,2,4,2,1,16,16,4,70,75,100663296,68753031168,683,0.784794,119.458,87606.5
3,CUTLASS,gemm,cutlass_tensorop_f16_s884gemm_f16_256x128_32x2_nt_align8,passed,success,universal,serial,2048,2048,2048,f16:column,f16:row,f16:column,1,0,1,4,tensorop,f32,256,128,32,1,1,1,2,4,2,1,16,16,4,70,75,100663296,68753031168,683,0.790804,118.55,86940.6
3,CUTLASS,gemm,cutlass_tensorop_f16_s884gemm_f16_256x128_32x2_tn_align8,passed,success,universal,serial,2048,2048,2048,f16:row,f16:column,f16:column,1,0,1,4,tensorop,f32,256,128,32,1,1,1,2,4,2,1,16,16,4,70,75,100663296,68753031168,683,0.809667,115.788,84915.2
3,CUTLASS,gemm,cutlass_tensorop_f16_s884gemm_f16_256x128_32x2_tt_align8,passed,success,universal,serial,2048,2048,2048,f16:row,f16:row,f16:column,1,0,1,4,tensorop,f32,256,128,32,1,1,1,2,4,2,1,16,16,4,70,75,100663296,68753031168,683,0.772024,121.434,89055.5
4,CUTLASS,gemm,cutlass_tensorop_s884gemm_f16_256x128_32x2_nn_align8,passed,success,universal,serial,2048,2048,2048,f16:column,f16:column,f32:column,1,0,1,8,tensorop,f32,256,128,32,1,1,1,2,4,2,1,16,16,4,70,75,268435456,137506062336,512,1.53352,163.023,89666.8
4,CUTLASS,gemm,cutlass_tensorop_s884gemm_f16_256x128_32x2_nt_align8,passed,success,universal,serial,2048,2048,2048,f16:column,f16:row,f32:column,1,0,1,8,tensorop,f32,256,128,32,1,1,1,2,4,2,1,16,16,4,70,75,268435456,137506062336,512,1.513,165.235,90883
4,CUTLASS,gemm,cutlass_tensorop_s884gemm_f16_256x128_32x2_tn_align8,passed,success,universal,serial,2048,2048,2048,f16:row,f16:column,f32:column,1,0,1,8,tensorop,f32,256,128,32,1,1,1,2,4,2,1,16,16,4,70,75,268435456,137506062336,512,1.59048,157.186,86455.9
4,CUTLASS,gemm,cutlass_tensorop_s884gemm_f16_256x128_32x2_tt_align8,passed,success,universal,serial,2048,2048,2048,f16:row,f16:row,f32:column,1,0,1,8,tensorop,f32,256,128,32,1,1,1,2,4,2,1,16,16,4,70,75,268435456,137506062336,512,1.50019,166.645,91659.1
4,CUTLASS,gemm,cutlass_tensorop_f16_s884gemm_f16_256x128_32x2_nn_align8,passed,success,universal,serial,2048,2048,2048,f16:column,f16:column,f16:column,1,0,1,8,tensorop,f32,256,128,32,1,1,1,2,4,2,1,16,16,4,70,75,201326592,137506062336,683,1.49304,125.582,92097.8
4,CUTLASS,gemm,cutlass_tensorop_f16_s884gemm_f16_256x128_32x2_nt_align8,passed,success,universal,serial,2048,2048,2048,f16:column,f16:row,f16:column,1,0,1,8,tensorop,f32,256,128,32,1,1,1,2,4,2,1,16,16,4,70,75,201326592,137506062336,683,1.47988,126.699,92916.7
4,CUTLASS,gemm,cutlass_tensorop_f16_s884gemm_f16_256x128_32x2_tn_align8,passed,success,universal,serial,2048,2048,2048,f16:row,f16:column,f16:column,1,0,1,8,tensorop,f32,256,128,32,1,1,1,2,4,2,1,16,16,4,70,75,201326592,137506062336,683,1.53553,122.108,89549.6
4,CUTLASS,gemm,cutlass_tensorop_f16_s884gemm_f16_256x128_32x2_tt_align8,passed,success,universal,serial,2048,2048,2048,f16:row,f16:row,f16:column,1,0,1,8,tensorop,f32,256,128,32,1,1,1,2,4,2,1,16,16,4,70,75,201326592,137506062336,683,1.46608,127.892,93791.6
5,CUTLASS,gemm,cutlass_tensorop_s884gemm_f16_256x128_32x2_nn_align8,passed,success,universal,serial,2048,2048,2048,f16:column,f16:column,f32:column,1,0,1,16,tensorop,f32,256,128,32,1,1,1,2,4,2,1,16,16,4,70,75,536870912,275012124672,512,3.07263,162.727,89503.7
5,CUTLASS,gemm,cutlass_tensorop_s884gemm_f16_256x128_32x2_nt_align8,passed,success,universal,serial,2048,2048,2048,f16:column,f16:row,f32:column,1,0,1,16,tensorop,f32,256,128,32,1,1,1,2,4,2,1,16,16,4,70,75,536870912,275012124672,512,3.04402,164.256,90344.9
5,CUTLASS,gemm,cutlass_tensorop_s884gemm_f16_256x128_32x2_tn_align8,passed,success,universal,serial,2048,2048,2048,f16:row,f16:column,f32:column,1,0,1,16,tensorop,f32,256,128,32,1,1,1,2,4,2,1,16,16,4,70,75,536870912,275012124672,512,3.19836,156.33,85985.3
5,CUTLASS,gemm,cutlass_tensorop_s884gemm_f16_256x128_32x2_tt_align8,passed,success,universal,serial,2048,2048,2048,f16:row,f16:row,f32:column,1,0,1,16,tensorop,f32,256,128,32,1,1,1,2,4,2,1,16,16,4,70,75,536870912,275012124672,512,3.02293,165.402,90975.4
5,CUTLASS,gemm,cutlass_tensorop_f16_s884gemm_f16_256x128_32x2_nn_align8,passed,success,universal,serial,2048,2048,2048,f16:column,f16:column,f16:column,1,0,1,16,tensorop,f32,256,128,32,1,1,1,2,4,2,1,16,16,4,70,75,402653184,275012124672,683,3.00922,124.617,91389.9
5,CUTLASS,gemm,cutlass_tensorop_f16_s884gemm_f16_256x128_32x2_nt_align8,passed,success,universal,serial,2048,2048,2048,f16:column,f16:row,f16:column,1,0,1,16,tensorop,f32,256,128,32,1,1,1,2,4,2,1,16,16,4,70,75,402653184,275012124672,683,2.97698,125.966,92379.5
5,CUTLASS,gemm,cutlass_tensorop_f16_s884gemm_f16_256x128_32x2_tn_align8,passed,success,universal,serial,2048,2048,2048,f16:row,f16:column,f16:column,1,0,1,16,tensorop,f32,256,128,32,1,1,1,2,4,2,1,16,16,4,70,75,402653184,275012124672,683,3.07042,122.133,89568.2
5,CUTLASS,gemm,cutlass_tensorop_f16_s884gemm_f16_256x128_32x2_tt_align8,passed,success,universal,serial,2048,2048,2048,f16:row,f16:row,f16:column,1,0,1,16,tensorop,f32,256,128,32,1,1,1,2,4,2,1,16,16,4,70,75,402653184,275012124672,683,2.95165,127.048,93172.4
6,CUTLASS,gemm,cutlass_tensorop_s884gemm_f16_256x128_32x2_nn_align8,passed,success,universal,serial,2048,2048,2048,f16:column,f16:column,f32:column,1,0,1,32,tensorop,f32,256,128,32,1,1,1,2,4,2,1,16,16,4,70,75,1073741824,550024249344,512,6.17127,162.041,89126.6
6,CUTLASS,gemm,cutlass_tensorop_s884gemm_f16_256x128_32x2_nt_align8,passed,success,universal,serial,2048,2048,2048,f16:column,f16:row,f32:column,1,0,1,32,tensorop,f32,256,128,32,1,1,1,2,4,2,1,16,16,4,70,75,1073741824,550024249344,512,6.10769,163.728,90054.4
6,CUTLASS,gemm,cutlass_tensorop_s884gemm_f16_256x128_32x2_tn_align8,passed,success,universal,serial,2048,2048,2048,f16:row,f16:column,f32:column,1,0,1,32,tensorop,f32,256,128,32,1,1,1,2,4,2,1,16,16,4,70,75,1073741824,550024249344,512,6.42534,155.634,85602.3
6,CUTLASS,gemm,cutlass_tensorop_s884gemm_f16_256x128_32x2_tt_align8,passed,success,universal,serial,2048,2048,2048,f16:row,f16:row,f32:column,1,0,1,32,tensorop,f32,256,128,32,1,1,1,2,4,2,1,16,16,4,70,75,1073741824,550024249344,512,6.04824,165.337,90939.6
6,CUTLASS,gemm,cutlass_tensorop_f16_s884gemm_f16_256x128_32x2_nn_align8,passed,success,universal,serial,2048,2048,2048,f16:column,f16:column,f16:column,1,0,1,32,tensorop,f32,256,128,32,1,1,1,2,4,2,1,16,16,4,70,75,805306368,550024249344,683,6.03228,124.331,91180.1
6,CUTLASS,gemm,cutlass_tensorop_f16_s884gemm_f16_256x128_32x2_nt_align8,passed,success,universal,serial,2048,2048,2048,f16:column,f16:row,f16:column,1,0,1,32,tensorop,f32,256,128,32,1,1,1,2,4,2,1,16,16,4,70,75,805306368,550024249344,683,5.98896,125.231,91839.8
6,CUTLASS,gemm,cutlass_tensorop_f16_s884gemm_f16_256x128_32x2_tn_align8,passed,success,universal,serial,2048,2048,2048,f16:row,f16:column,f16:column,1,0,1,32,tensorop,f32,256,128,32,1,1,1,2,4,2,1,16,16,4,70,75,805306368,550024249344,683,6.18041,121.351,88994.7
6,CUTLASS,gemm,cutlass_tensorop_f16_s884gemm_f16_256x128_32x2_tt_align8,passed,success,universal,serial,2048,2048,2048,f16:row,f16:row,f16:column,1,0,1,32,tensorop,f32,256,128,32,1,1,1,2,4,2,1,16,16,4,70,75,805306368,550024249344,683,5.9345,126.38,92682.5
7,CUTLASS,gemm,cutlass_tensorop_s884gemm_f16_256x128_32x2_nn_align8,passed,success,universal,serial,2048,2048,2048,f16:column,f16:column,f32:column,1,0,1,64,tensorop,f32,256,128,32,1,1,1,2,4,2,1,16,16,4,70,75,2147483648,1100048498688,512,12.2988,162.618,89443.9
7,CUTLASS,gemm,cutlass_tensorop_s884gemm_f16_256x128_32x2_nt_align8,passed,success,universal,serial,2048,2048,2048,f16:column,f16:row,f32:column,1,0,1,64,tensorop,f32,256,128,32,1,1,1,2,4,2,1,16,16,4,70,75,2147483648,1100048498688,512,12.1789,164.219,90324.5
7,CUTLASS,gemm,cutlass_tensorop_s884gemm_f16_256x128_32x2_tn_align8,passed,success,universal,serial,2048,2048,2048,f16:row,f16:column,f32:column,1,0,1,64,tensorop,f32,256,128,32,1,1,1,2,4,2,1,16,16,4,70,75,2147483648,1100048498688,512,12.8098,156.13,85875.3
7,CUTLASS,gemm,cutlass_tensorop_s884gemm_f16_256x128_32x2_tt_align8,passed,success,universal,serial,2048,2048,2048,f16:row,f16:row,f32:column,1,0,1,64,tensorop,f32,256,128,32,1,1,1,2,4,2,1,16,16,4,70,75,2147483648,1100048498688,512,12.0974,165.325,90933
7,CUTLASS,gemm,cutlass_tensorop_f16_s884gemm_f16_256x128_32x2_nn_align8,passed,success,universal,serial,2048,2048,2048,f16:column,f16:column,f16:column,1,0,1,64,tensorop,f32,256,128,32,1,1,1,2,4,2,1,16,16,4,70,75,1610612736,1100048498688,683,12.067,124.306,91161.6
7,CUTLASS,gemm,cutlass_tensorop_f16_s884gemm_f16_256x128_32x2_nt_align8,passed,success,universal,serial,2048,2048,2048,f16:column,f16:row,f16:column,1,0,1,64,tensorop,f32,256,128,32,1,1,1,2,4,2,1,16,16,4,70,75,1610612736,1100048498688,683,11.896,126.093,92472
7,CUTLASS,gemm,cutlass_tensorop_f16_s884gemm_f16_256x128_32x2_tn_align8,passed,success,universal,serial,2048,2048,2048,f16:row,f16:column,f16:column,1,0,1,64,tensorop,f32,256,128,32,1,1,1,2,4,2,1,16,16,4,70,75,1610612736,1100048498688,683,12.3713,121.249,88919.5
7,CUTLASS,gemm,cutlass_tensorop_f16_s884gemm_f16_256x128_32x2_tt_align8,passed,success,universal,serial,2048,2048,2048,f16:row,f16:row,f16:column,1,0,1,64,tensorop,f32,256,128,32,1,1,1,2,4,2,1,16,16,4,70,75,1610612736,1100048498688,683,11.8259,126.84,93020
8,CUTLASS,gemm,cutlass_tensorop_s884gemm_f16_256x128_32x2_nn_align8,passed,success,universal,serial,2048,2048,2048,f16:column,f16:column,f32:column,1,0,1,128,tensorop,f32,256,128,32,1,1,1,2,4,2,1,16,16,4,70,75,4294967296,2200096997376,512,24.6447,162.307,89272.5
8,CUTLASS,gemm,cutlass_tensorop_s884gemm_f16_256x128_32x2_nt_align8,passed,success,universal,serial,2048,2048,2048,f16:column,f16:row,f32:column,1,0,1,128,tensorop,f32,256,128,32,1,1,1,2,4,2,1,16,16,4,70,75,4294967296,2200096997376,512,24.5089,163.206,89767.1
8,CUTLASS,gemm,cutlass_tensorop_s884gemm_f16_256x128_32x2_tn_align8,passed,success,universal,serial,2048,2048,2048,f16:row,f16:column,f32:column,1,0,1,128,tensorop,f32,256,128,32,1,1,1,2,4,2,1,16,16,4,70,75,4294967296,2200096997376,512,25.7104,155.579,85572.4
8,CUTLASS,gemm,cutlass_tensorop_s884gemm_f16_256x128_32x2_tt_align8,passed,success,universal,serial,2048,2048,2048,f16:row,f16:row,f32:column,1,0,1,128,tensorop,f32,256,128,32,1,1,1,2,4,2,1,16,16,4,70,75,4294967296,2200096997376,512,24.2344,165.055,90784
8,CUTLASS,gemm,cutlass_tensorop_f16_s884gemm_f16_256x128_32x2_nn_align8,passed,success,universal,serial,2048,2048,2048,f16:column,f16:column,f16:column,1,0,1,128,tensorop,f32,256,128,32,1,1,1,2,4,2,1,16,16,4,70,75,3221225472,2200096997376,683,24.196,123.987,90928
8,CUTLASS,gemm,cutlass_tensorop_f16_s884gemm_f16_256x128_32x2_nt_align8,passed,success,universal,serial,2048,2048,2048,f16:column,f16:row,f16:column,1,0,1,128,tensorop,f32,256,128,32,1,1,1,2,4,2,1,16,16,4,70,75,3221225472,2200096997376,683,23.9475,125.274,91871.7
8,CUTLASS,gemm,cutlass_tensorop_f16_s884gemm_f16_256x128_32x2_tn_align8,passed,success,universal,serial,2048,2048,2048,f16:row,f16:column,f16:column,1,0,1,128,tensorop,f32,256,128,32,1,1,1,2,4,2,1,16,16,4,70,75,3221225472,2200096997376,683,24.7984,120.975,88719.2
8,CUTLASS,gemm,cutlass_tensorop_f16_s884gemm_f16_256x128_32x2_tt_align8,passed,success,universal,serial,2048,2048,2048,f16:row,f16:row,f16:column,1,0,1,128,tensorop,f32,256,128,32,1,1,1,2,4,2,1,16,16,4,70,75,3221225472,2200096997376,683,23.731,126.417,92709.8
