out.gemm.csv
Problem,Provider,OperationKind,Operation,Disposition,Status,gemm_kind,split_k_mode,m,n,k,A,B,C,alpha,beta,split_k_slices,batch_count,op_class,accum,cta_m,cta_n,cta_k,cluster_m,cluster_n,cluster_k,stages,warps_m,warps_n,warps_k,inst_m,inst_n,inst_k,min_cc,max_cc,Bytes,Flops,Flops/Byte,Runtime,GB/s,GFLOPs
43,CUTLASS,gemm,cutlass_tensorop_s884gemm_f16_256x128_32x2_nt_align8,passed,success,universal,serial,8,8,1,f16:column,f16:row,f32:column,1,0,1,1,tensorop,f32,256,128,32,1,1,1,2,4,2,1,16,16,4,70,75,288,256,0,0.00932864,0.0287524,0.0274424
43,CUTLASS,gemm,cutlass_tensorop_f16_s884gemm_f16_256x128_32x2_nt_align8,passed,success,universal,serial,8,8,1,f16:column,f16:row,f16:column,1,0,1,1,tensorop,f32,256,128,32,1,1,1,2,4,2,1,16,16,4,70,75,160,256,1,0.0106906,0.0139386,0.0239464
44,CUTLASS,gemm,cutlass_tensorop_s884gemm_f16_256x128_32x2_nt_align8,passed,success,universal,serial,16,8,1,f16:column,f16:row,f32:column,1,0,1,1,tensorop,f32,256,128,32,1,1,1,2,4,2,1,16,16,4,70,75,560,512,0,0.0093184,0.0559689,0.0549451
44,CUTLASS,gemm,cutlass_tensorop_f16_s884gemm_f16_256x128_32x2_nt_align8,passed,success,universal,serial,16,8,1,f16:column,f16:row,f16:column,1,0,1,1,tensorop,f32,256,128,32,1,1,1,2,4,2,1,16,16,4,70,75,304,512,1,0.0106906,0.0264834,0.0478927
45,CUTLASS,gemm,cutlass_tensorop_s884gemm_f16_256x128_32x2_nt_align8,passed,success,universal,serial,32,8,1,f16:column,f16:row,f32:column,1,0,1,1,tensorop,f32,256,128,32,1,1,1,2,4,2,1,16,16,4,70,75,1104,1024,0,0.00930816,0.11046,0.110011
45,CUTLASS,gemm,cutlass_tensorop_f16_s884gemm_f16_256x128_32x2_nt_align8,passed,success,universal,serial,32,8,1,f16:column,f16:row,f16:column,1,0,1,1,tensorop,f32,256,128,32,1,1,1,2,4,2,1,16,16,4,70,75,592,1024,1,0.0106906,0.0515729,0.0957854
46,CUTLASS,gemm,cutlass_tensorop_s884gemm_f16_256x128_32x2_nt_align8,passed,success,universal,serial,64,8,1,f16:column,f16:row,f32:column,1,0,1,1,tensorop,f32,256,128,32,1,1,1,2,4,2,1,16,16,4,70,75,2192,2048,0,0.00933888,0.218598,0.219298
46,CUTLASS,gemm,cutlass_tensorop_f16_s884gemm_f16_256x128_32x2_nt_align8,passed,success,universal,serial,64,8,1,f16:column,f16:row,f16:column,1,0,1,1,tensorop,f32,256,128,32,1,1,1,2,4,2,1,16,16,4,70,75,1168,2048,1,0.0106803,0.101849,0.191755
47,CUTLASS,gemm,cutlass_tensorop_s884gemm_f16_256x128_32x2_nt_align8,passed,success,universal,serial,128,8,1,f16:column,f16:row,f32:column,1,0,1,1,tensorop,f32,256,128,32,1,1,1,2,4,2,1,16,16,4,70,75,4368,4096,0,0.00937984,0.433698,0.436681
47,CUTLASS,gemm,cutlass_tensorop_f16_s884gemm_f16_256x128_32x2_nt_align8,passed,success,universal,serial,128,8,1,f16:column,f16:row,f16:column,1,0,1,1,tensorop,f32,256,128,32,1,1,1,2,4,2,1,16,16,4,70,75,2320,4096,1,0.0106906,0.20211,0.383142
48,CUTLASS,gemm,cutlass_tensorop_s884gemm_f16_256x128_32x2_nt_align8,passed,success,universal,serial,256,8,1,f16:column,f16:row,f32:column,1,0,1,1,tensorop,f32,256,128,32,1,1,1,2,4,2,1,16,16,4,70,75,8720,8192,0,0.00941056,0.862981,0.870511
48,CUTLASS,gemm,cutlass_tensorop_f16_s884gemm_f16_256x128_32x2_nt_align8,passed,success,universal,serial,256,8,1,f16:column,f16:row,f16:column,1,0,1,1,tensorop,f32,256,128,32,1,1,1,2,4,2,1,16,16,4,70,75,4624,8192,1,0.0107008,0.402441,0.76555
49,CUTLASS,gemm,cutlass_tensorop_s884gemm_f16_256x128_32x2_nt_align8,passed,success,universal,serial,512,8,1,f16:column,f16:row,f32:column,1,0,1,1,tensorop,f32,256,128,32,1,1,1,2,4,2,1,16,16,4,70,75,17424,16384,0,0.00950272,1.70765,1.72414
49,CUTLASS,gemm,cutlass_tensorop_f16_s884gemm_f16_256x128_32x2_nt_align8,passed,success,universal,serial,512,8,1,f16:column,f16:row,f16:column,1,0,1,1,tensorop,f32,256,128,32,1,1,1,2,4,2,1,16,16,4,70,75,9232,16384,1,0.0107008,0.803488,1.5311
50,CUTLASS,gemm,cutlass_tensorop_s884gemm_f16_256x128_32x2_nt_align8,passed,success,universal,serial,1024,8,1,f16:column,f16:row,f32:column,1,0,1,1,tensorop,f32,256,128,32,1,1,1,2,4,2,1,16,16,4,70,75,34832,32768,0,0.00940032,3.45093,3.48584
50,CUTLASS,gemm,cutlass_tensorop_f16_s884gemm_f16_256x128_32x2_nt_align8,passed,success,universal,serial,1024,8,1,f16:column,f16:row,f16:column,1,0,1,1,tensorop,f32,256,128,32,1,1,1,2,4,2,1,16,16,4,70,75,18448,32768,1,0.0107008,1.60558,3.0622
51,CUTLASS,gemm,cutlass_tensorop_s884gemm_f16_256x128_32x2_nt_align8,passed,success,universal,serial,2048,8,1,f16:column,f16:row,f32:column,1,0,1,1,tensorop,f32,256,128,32,1,1,1,2,4,2,1,16,16,4,70,75,69648,65536,0,0.00941056,6.89276,6.96409
51,CUTLASS,gemm,cutlass_tensorop_f16_s884gemm_f16_256x128_32x2_nt_align8,passed,success,universal,serial,2048,8,1,f16:column,f16:row,f16:column,1,0,1,1,tensorop,f32,256,128,32,1,1,1,2,4,2,1,16,16,4,70,75,36880,65536,1,0.010711,3.20671,6.11855
52,CUTLASS,gemm,cutlass_tensorop_s884gemm_f16_256x128_32x2_nt_align8,passed,success,universal,serial,4096,8,1,f16:column,f16:row,f32:column,1,0,1,1,tensorop,f32,256,128,32,1,1,1,2,4,2,1,16,16,4,70,75,139280,131072,0,0.00945152,13.7242,13.8678
52,CUTLASS,gemm,cutlass_tensorop_f16_s884gemm_f16_256x128_32x2_nt_align8,passed,success,universal,serial,4096,8,1,f16:column,f16:row,f16:column,1,0,1,1,tensorop,f32,256,128,32,1,1,1,2,4,2,1,16,16,4,70,75,73744,131072,1,0.0107418,6.39369,12.2021
56,CUTLASS,gemm,cutlass_tensorop_s884gemm_f16_256x128_32x2_nt_align8,passed,success,universal,serial,8,16,1,f16:column,f16:row,f32:column,1,0,1,1,tensorop,f32,256,128,32,1,1,1,2,4,2,1,16,16,4,70,75,560,512,0,0.00932864,0.0559075,0.0548847
56,CUTLASS,gemm,cutlass_tensorop_f16_s884gemm_f16_256x128_32x2_nt_align8,passed,success,universal,serial,8,16,1,f16:column,f16:row,f16:column,1,0,1,1,tensorop,f32,256,128,32,1,1,1,2,4,2,1,16,16,4,70,75,304,512,1,0.0106803,0.0265088,0.0479386
57,CUTLASS,gemm,cutlass_tensorop_s884gemm_f16_256x128_32x2_nt_align8,passed,success,universal,serial,16,16,1,f16:column,f16:row,f32:column,1,0,1,1,tensorop,f32,256,128,32,1,1,1,2,4,2,1,16,16,4,70,75,1088,1024,0,0.0093184,0.10874,0.10989
57,CUTLASS,gemm,cutlass_tensorop_f16_s884gemm_f16_256x128_32x2_nt_align8,passed,success,universal,serial,16,16,1,f16:column,f16:row,f16:column,1,0,1,1,tensorop,f32,256,128,32,1,1,1,2,4,2,1,16,16,4,70,75,576,1024,1,0.010711,0.0500831,0.0956023
58,CUTLASS,gemm,cutlass_tensorop_s884gemm_f16_256x128_32x2_nt_align8,passed,success,universal,serial,32,16,1,f16:column,f16:row,f32:column,1,0,1,1,tensorop,f32,256,128,32,1,1,1,2,4,2,1,16,16,4,70,75,2144,2048,0,0.00932864,0.214046,0.219539
58,CUTLASS,gemm,cutlass_tensorop_f16_s884gemm_f16_256x128_32x2_nt_align8,passed,success,universal,serial,32,16,1,f16:column,f16:row,f16:column,1,0,1,1,tensorop,f32,256,128,32,1,1,1,2,4,2,1,16,16,4,70,75,1120,2048,1,0.0106906,0.0975703,0.191571
59,CUTLASS,gemm,cutlass_tensorop_s884gemm_f16_256x128_32x2_nt_align8,passed,success,universal,serial,64,16,1,f16:column,f16:row,f32:column,1,0,1,1,tensorop,f32,256,128,32,1,1,1,2,4,2,1,16,16,4,70,75,4256,4096,0,0.00934912,0.423966,0.438116
59,CUTLASS,gemm,cutlass_tensorop_f16_s884gemm_f16_256x128_32x2_nt_align8,passed,success,universal,serial,64,16,1,f16:column,f16:row,f16:column,1,0,1,1,tensorop,f32,256,128,32,1,1,1,2,4,2,1,16,16,4,70,75,2208,4096,1,0.0106906,0.192353,0.383142
60,CUTLASS,gemm,cutlass_tensorop_s884gemm_f16_256x128_32x2_nt_align8,passed,success,universal,serial,128,16,1,f16:column,f16:row,f32:column,1,0,1,1,tensorop,f32,256,128,32,1,1,1,2,4,2,1,16,16,4,70,75,8480,8192,0,0.00953344,0.828412,0.859291
60,CUTLASS,gemm,cutlass_tensorop_f16_s884gemm_f16_256x128_32x2_nt_align8,passed,success,universal,serial,128,16,1,f16:column,f16:row,f16:column,1,0,1,1,tensorop,f32,256,128,32,1,1,1,2,4,2,1,16,16,4,70,75,4384,8192,1,0.0106906,0.381918,0.766284
61,CUTLASS,gemm,cutlass_tensorop_s884gemm_f16_256x128_32x2_nt_align8,passed,success,universal,serial,256,16,1,f16:column,f16:row,f32:column,1,0,1,1,tensorop,f32,256,128,32,1,1,1,2,4,2,1,16,16,4,70,75,16928,16384,0,0.00953344,1.6537,1.71858
61,CUTLASS,gemm,cutlass_tensorop_f16_s884gemm_f16_256x128_32x2_nt_align8,passed,success,universal,serial,256,16,1,f16:column,f16:row,f16:column,1,0,1,1,tensorop,f32,256,128,32,1,1,1,2,4,2,1,16,16,4,70,75,8736,16384,1,0.0106906,0.761048,1.53257
62,CUTLASS,gemm,cutlass_tensorop_s884gemm_f16_256x128_32x2_nt_align8,passed,success,universal,serial,512,16,1,f16:column,f16:row,f32:column,1,0,1,1,tensorop,f32,256,128,32,1,1,1,2,4,2,1,16,16,4,70,75,33824,32768,0,0.00953344,3.30427,3.43716
62,CUTLASS,gemm,cutlass_tensorop_f16_s884gemm_f16_256x128_32x2_nt_align8,passed,success,universal,serial,512,16,1,f16:column,f16:row,f16:column,1,0,1,1,tensorop,f32,256,128,32,1,1,1,2,4,2,1,16,16,4,70,75,17440,32768,1,0.0107213,1.51496,3.05635
63,CUTLASS,gemm,cutlass_tensorop_s884gemm_f16_256x128_32x2_nt_align8,passed,success,universal,serial,1024,16,1,f16:column,f16:row,f32:column,1,0,1,1,tensorop,f32,256,128,32,1,1,1,2,4,2,1,16,16,4,70,75,67616,65536,0,0.00953344,6.60541,6.87433
63,CUTLASS,gemm,cutlass_tensorop_f16_s884gemm_f16_256x128_32x2_nt_align8,passed,success,universal,serial,1024,16,1,f16:column,f16:row,f16:column,1,0,1,1,tensorop,f32,256,128,32,1,1,1,2,4,2,1,16,16,4,70,75,34848,65536,1,0.010711,3.03003,6.11855
64,CUTLASS,gemm,cutlass_tensorop_s884gemm_f16_256x128_32x2_nt_align8,passed,success,universal,serial,2048,16,1,f16:column,f16:row,f32:column,1,0,1,1,tensorop,f32,256,128,32,1,1,1,2,4,2,1,16,16,4,70,75,135200,131072,0,0.0095232,13.2219,13.7634
64,CUTLASS,gemm,cutlass_tensorop_f16_s884gemm_f16_256x128_32x2_nt_align8,passed,success,universal,serial,2048,16,1,f16:column,f16:row,f16:column,1,0,1,1,tensorop,f32,256,128,32,1,1,1,2,4,2,1,16,16,4,70,75,69664,131072,1,0.0107315,6.04571,12.2137
65,CUTLASS,gemm,cutlass_tensorop_s884gemm_f16_256x128_32x2_nt_align8,passed,success,universal,serial,4096,16,1,f16:column,f16:row,f32:column,1,0,1,1,tensorop,f32,256,128,32,1,1,1,2,4,2,1,16,16,4,70,75,270368,262144,0,0.00956416,26.3274,27.409
65,CUTLASS,gemm,cutlass_tensorop_f16_s884gemm_f16_256x128_32x2_nt_align8,passed,success,universal,serial,4096,16,1,f16:column,f16:row,f16:column,1,0,1,1,tensorop,f32,256,128,32,1,1,1,2,4,2,1,16,16,4,70,75,139296,262144,1,0.0108032,12.0084,24.2654
69,CUTLASS,gemm,cutlass_tensorop_s884gemm_f16_256x128_32x2_nt_align8,passed,success,universal,serial,8,32,1,f16:column,f16:row,f32:column,1,0,1,1,tensorop,f32,256,128,32,1,1,1,2,4,2,1,16,16,4,70,75,1104,1024,0,0.0093184,0.110339,0.10989
69,CUTLASS,gemm,cutlass_tensorop_f16_s884gemm_f16_256x128_32x2_nt_align8,passed,success,universal,serial,8,32,1,f16:column,f16:row,f16:column,1,0,1,1,tensorop,f32,256,128,32,1,1,1,2,4,2,1,16,16,4,70,75,592,1024,1,0.0106906,0.0515729,0.0957854
70,CUTLASS,gemm,cutlass_tensorop_s884gemm_f16_256x128_32x2_nt_align8,passed,success,universal,serial,16,32,1,f16:column,f16:row,f32:column,1,0,1,1,tensorop,f32,256,128,32,1,1,1,2,4,2,1,16,16,4,70,75,2144,2048,0,0.0093184,0.214281,0.21978
70,CUTLASS,gemm,cutlass_tensorop_f16_s884gemm_f16_256x128_32x2_nt_align8,passed,success,universal,serial,16,32,1,f16:column,f16:row,f16:column,1,0,1,1,tensorop,f32,256,128,32,1,1,1,2,4,2,1,16,16,4,70,75,1120,2048,1,0.0106803,0.0976639,0.191755
71,CUTLASS,gemm,cutlass_tensorop_s884gemm_f16_256x128_32x2_nt_align8,passed,success,universal,serial,32,32,1,f16:column,f16:row,f32:column,1,0,1,1,tensorop,f32,256,128,32,1,1,1,2,4,2,1,16,16,4,70,75,4224,4096,0,0.00939008,0.418943,0.436205
71,CUTLASS,gemm,cutlass_tensorop_f16_s884gemm_f16_256x128_32x2_nt_align8,passed,success,universal,serial,32,32,1,f16:column,f16:row,f16:column,1,0,1,1,tensorop,f32,256,128,32,1,1,1,2,4,2,1,16,16,4,70,75,2176,4096,1,0.0106906,0.189565,0.383142
72,CUTLASS,gemm,cutlass_tensorop_s884gemm_f16_256x128_32x2_nt_align8,passed,success,universal,serial,64,32,1,f16:column,f16:row,f32:column,1,0,1,1,tensorop,f32,256,128,32,1,1,1,2,4,2,1,16,16,4,70,75,8384,8192,0,0.00953344,0.819034,0.859291
72,CUTLASS,gemm,cutlass_tensorop_f16_s884gemm_f16_256x128_32x2_nt_align8,passed,success,universal,serial,64,32,1,f16:column,f16:row,f16:column,1,0,1,1,tensorop,f32,256,128,32,1,1,1,2,4,2,1,16,16,4,70,75,4288,8192,1,0.0106906,0.373555,0.766284
73,CUTLASS,gemm,cutlass_tensorop_s884gemm_f16_256x128_32x2_nt_align8,passed,success,universal,serial,128,32,1,f16:column,f16:row,f32:column,1,0,1,1,tensorop,f32,256,128,32,1,1,1,2,4,2,1,16,16,4,70,75,16704,16384,0,0.00955392,1.62832,1.7149
73,CUTLASS,gemm,cutlass_tensorop_f16_s884gemm_f16_256x128_32x2_nt_align8,passed,success,universal,serial,128,32,1,f16:column,f16:row,f16:column,1,0,1,1,tensorop,f32,256,128,32,1,1,1,2,4,2,1,16,16,4,70,75,8512,16384,1,0.0107213,0.73941,1.52818
74,CUTLASS,gemm,cutlass_tensorop_s884gemm_f16_256x128_32x2_nt_align8,passed,success,universal,serial,256,32,1,f16:column,f16:row,f32:column,1,0,1,1,tensorop,f32,256,128,32,1,1,1,2,4,2,1,16,16,4,70,75,33344,32768,0,0.00954368,3.25388,3.43348
74,CUTLASS,gemm,cutlass_tensorop_f16_s884gemm_f16_256x128_32x2_nt_align8,passed,success,universal,serial,256,32,1,f16:column,f16:row,f16:column,1,0,1,1,tensorop,f32,256,128,32,1,1,1,2,4,2,1,16,16,4,70,75,16960,32768,1,0.0108237,1.45932,3.02744
75,CUTLASS,gemm,cutlass_tensorop_s884gemm_f16_256x128_32x2_nt_align8,passed,success,universal,serial,512,32,1,f16:column,f16:row,f32:column,1,0,1,1,tensorop,f32,256,128,32,1,1,1,2,4,2,1,16,16,4,70,75,66624,65536,0,0.00955392,6.49455,6.85959
75,CUTLASS,gemm,cutlass_tensorop_f16_s884gemm_f16_256x128_32x2_nt_align8,passed,success,universal,serial,512,32,1,f16:column,f16:row,f16:column,1,0,1,1,tensorop,f32,256,128,32,1,1,1,2,4,2,1,16,16,4,70,75,33856,65536,1,0.0108851,2.89669,6.0207
76,CUTLASS,gemm,cutlass_tensorop_s884gemm_f16_256x128_32x2_nt_align8,passed,success,universal,serial,1024,32,1,f16:column,f16:row,f32:column,1,0,1,1,tensorop,f32,256,128,32,1,1,1,2,4,2,1,16,16,4,70,75,133184,131072,0,0.00956416,12.969,13.7045
76,CUTLASS,gemm,cutlass_tensorop_f16_s884gemm_f16_256x128_32x2_nt_align8,passed,success,universal,serial,1024,32,1,f16:column,f16:row,f16:column,1,0,1,1,tensorop,f32,256,128,32,1,1,1,2,4,2,1,16,16,4,70,75,67648,131072,1,0.0108339,5.81526,12.0983
77,CUTLASS,gemm,cutlass_tensorop_s884gemm_f16_256x128_32x2_nt_align8,passed,success,universal,serial,2048,32,1,f16:column,f16:row,f32:column,1,0,1,1,tensorop,f32,256,128,32,1,1,1,2,4,2,1,16,16,4,70,75,266304,262144,0,0.00958464,25.8763,27.3504
77,CUTLASS,gemm,cutlass_tensorop_f16_s884gemm_f16_256x128_32x2_nt_align8,passed,success,universal,serial,2048,32,1,f16:column,f16:row,f16:column,1,0,1,1,tensorop,f32,256,128,32,1,1,1,2,4,2,1,16,16,4,70,75,135232,262144,1,0.0107827,11.6802,24.3115
78,CUTLASS,gemm,cutlass_tensorop_s884gemm_f16_256x128_32x2_nt_align8,passed,success,universal,serial,4096,32,1,f16:column,f16:row,f32:column,1,0,1,1,tensorop,f32,256,128,32,1,1,1,2,4,2,1,16,16,4,70,75,532544,524288,0,0.00959488,51.6911,54.6425
78,CUTLASS,gemm,cutlass_tensorop_f16_s884gemm_f16_256x128_32x2_nt_align8,passed,success,universal,serial,4096,32,1,f16:column,f16:row,f16:column,1,0,1,1,tensorop,f32,256,128,32,1,1,1,2,4,2,1,16,16,4,70,75,270400,524288,1,0.0108646,23.1788,48.2564
82,CUTLASS,gemm,cutlass_tensorop_s884gemm_f16_256x128_32x2_nt_align8,passed,success,universal,serial,8,64,1,f16:column,f16:row,f32:column,1,0,1,1,tensorop,f32,256,128,32,1,1,1,2,4,2,1,16,16,4,70,75,2192,2048,0,0.00933888,0.218598,0.219298
82,CUTLASS,gemm,cutlass_tensorop_f16_s884gemm_f16_256x128_32x2_nt_align8,passed,success,universal,serial,8,64,1,f16:column,f16:row,f16:column,1,0,1,1,tensorop,f32,256,128,32,1,1,1,2,4,2,1,16,16,4,70,75,1168,2048,1,0.0106906,0.101752,0.191571
83,CUTLASS,gemm,cutlass_tensorop_s884gemm_f16_256x128_32x2_nt_align8,passed,success,universal,serial,16,64,1,f16:column,f16:row,f32:column,1,0,1,1,tensorop,f32,256,128,32,1,1,1,2,4,2,1,16,16,4,70,75,4256,4096,0,0.00939008,0.422117,0.436205
83,CUTLASS,gemm,cutlass_tensorop_f16_s884gemm_f16_256x128_32x2_nt_align8,passed,success,universal,serial,16,64,1,f16:column,f16:row,f16:column,1,0,1,1,tensorop,f32,256,128,32,1,1,1,2,4,2,1,16,16,4,70,75,2208,4096,1,0.0106803,0.192537,0.383509
84,CUTLASS,gemm,cutlass_tensorop_s884gemm_f16_256x128_32x2_nt_align8,passed,success,universal,serial,32,64,1,f16:column,f16:row,f32:column,1,0,1,1,tensorop,f32,256,128,32,1,1,1,2,4,2,1,16,16,4,70,75,8384,8192,0,0.00951296,0.820797,0.861141
84,CUTLASS,gemm,cutlass_tensorop_f16_s884gemm_f16_256x128_32x2_nt_align8,passed,success,universal,serial,32,64,1,f16:column,f16:row,f16:column,1,0,1,1,tensorop,f32,256,128,32,1,1,1,2,4,2,1,16,16,4,70,75,4288,8192,1,0.0107008,0.373197,0.76555
85,CUTLASS,gemm,cutlass_tensorop_s884gemm_f16_256x128_32x2_nt_align8,passed,success,universal,serial,64,64,1,f16:column,f16:row,f32:column,1,0,1,1,tensorop,f32,256,128,32,1,1,1,2,4,2,1,16,16,4,70,75,16640,16384,0,0.00954368,1.62382,1.71674
85,CUTLASS,gemm,cutlass_tensorop_f16_s884gemm_f16_256x128_32x2_nt_align8,passed,success,universal,serial,64,64,1,f16:column,f16:row,f16:column,1,0,1,1,tensorop,f32,256,128,32,1,1,1,2,4,2,1,16,16,4,70,75,8448,16384,1,0.0106803,0.736665,1.53404
86,CUTLASS,gemm,cutlass_tensorop_s884gemm_f16_256x128_32x2_nt_align8,passed,success,universal,serial,128,64,1,f16:column,f16:row,f32:column,1,0,1,1,tensorop,f32,256,128,32,1,1,1,2,4,2,1,16,16,4,70,75,33152,32768,0,0.00976896,3.16054,3.3543
86,CUTLASS,gemm,cutlass_tensorop_f16_s884gemm_f16_256x128_32x2_nt_align8,passed,success,universal,serial,128,64,1,f16:column,f16:row,f16:column,1,0,1,1,tensorop,f32,256,128,32,1,1,1,2,4,2,1,16,16,4,70,75,16768,32768,1,0.0108646,1.43736,3.01602
87,CUTLASS,gemm,cutlass_tensorop_s884gemm_f16_256x128_32x2_nt_align8,passed,success,universal,serial,256,64,1,f16:column,f16:row,f32:column,1,0,1,1,tensorop,f32,256,128,32,1,1,1,2,4,2,1,16,16,4,70,75,66176,65536,0,0.00978944,6.29568,6.69456
87,CUTLASS,gemm,cutlass_tensorop_f16_s884gemm_f16_256x128_32x2_nt_align8,passed,success,universal,serial,256,64,1,f16:column,f16:row,f16:column,1,0,1,1,tensorop,f32,256,128,32,1,1,1,2,4,2,1,16,16,4,70,75,33408,65536,1,0.0108954,2.85568,6.01504
88,CUTLASS,gemm,cutlass_tensorop_s884gemm_f16_256x128_32x2_nt_align8,passed,success,universal,serial,512,64,1,f16:column,f16:row,f32:column,1,0,1,1,tensorop,f32,256,128,32,1,1,1,2,4,2,1,16,16,4,70,75,132224,131072,0,0.00979968,12.566,13.3751
88,CUTLASS,gemm,cutlass_tensorop_f16_s884gemm_f16_256x128_32x2_nt_align8,passed,success,universal,serial,512,64,1,f16:column,f16:row,f16:column,1,0,1,1,tensorop,f32,256,128,32,1,1,1,2,4,2,1,16,16,4,70,75,66688,131072,1,0.0109363,5.67906,11.985
89,CUTLASS,gemm,cutlass_tensorop_s884gemm_f16_256x128_32x2_nt_align8,passed,success,universal,serial,1024,64,1,f16:column,f16:row,f32:column,1,0,1,1,tensorop,f32,256,128,32,1,1,1,2,4,2,1,16,16,4,70,75,264320,262144,0,0.0098304,25.0414,26.6667
89,CUTLASS,gemm,cutlass_tensorop_f16_s884gemm_f16_256x128_32x2_nt_align8,passed,success,universal,serial,1024,64,1,f16:column,f16:row,f16:column,1,0,1,1,tensorop,f32,256,128,32,1,1,1,2,4,2,1,16,16,4,70,75,133248,262144,1,0.0109056,11.3792,24.0376
90,CUTLASS,gemm,cutlass_tensorop_s884gemm_f16_256x128_32x2_nt_align8,passed,success,universal,serial,2048,64,1,f16:column,f16:row,f32:column,1,0,1,1,tensorop,f32,256,128,32,1,1,1,2,4,2,1,16,16,4,70,75,528512,524288,0,0.00992256,49.6057,52.838
90,CUTLASS,gemm,cutlass_tensorop_f16_s884gemm_f16_256x128_32x2_nt_align8,passed,success,universal,serial,2048,64,1,f16:column,f16:row,f16:column,1,0,1,1,tensorop,f32,256,128,32,1,1,1,2,4,2,1,16,16,4,70,75,266368,524288,1,0.0109466,22.6623,47.8952
91,CUTLASS,gemm,cutlass_tensorop_s884gemm_f16_256x128_32x2_nt_align8,passed,success,universal,serial,4096,64,1,f16:column,f16:row,f32:column,1,0,1,1,tensorop,f32,256,128,32,1,1,1,2,4,2,1,16,16,4,70,75,1056896,1048576,0,0.0100352,98.0858,104.49
91,CUTLASS,gemm,cutlass_tensorop_f16_s884gemm_f16_256x128_32x2_nt_align8,passed,success,universal,serial,4096,64,1,f16:column,f16:row,f16:column,1,0,1,1,tensorop,f32,256,128,32,1,1,1,2,4,2,1,16,16,4,70,75,532608,1048576,1,0.0110899,44.728,94.5522
95,CUTLASS,gemm,cutlass_tensorop_s884gemm_f16_256x128_32x2_nt_align8,passed,success,universal,serial,8,128,1,f16:column,f16:row,f32:column,1,0,1,1,tensorop,f32,256,128,32,1,1,1,2,4,2,1,16,16,4,70,75,4368,4096,0,0.00950272,0.42809,0.431034
95,CUTLASS,gemm,cutlass_tensorop_f16_s884gemm_f16_256x128_32x2_nt_align8,passed,success,universal,serial,8,128,1,f16:column,f16:row,f16:column,1,0,1,1,tensorop,f32,256,128,32,1,1,1,2,4,2,1,16,16,4,70,75,2320,4096,1,0.0106906,0.20211,0.383142
96,CUTLASS,gemm,cutlass_tensorop_s884gemm_f16_256x128_32x2_nt_align8,passed,success,universal,serial,16,128,1,f16:column,f16:row,f32:column,1,0,1,1,tensorop,f32,256,128,32,1,1,1,2,4,2,1,16,16,4,70,75,8480,8192,0,0.00951296,0.830195,0.861141
96,CUTLASS,gemm,cutlass_tensorop_f16_s884gemm_f16_256x128_32x2_nt_align8,passed,success,universal,serial,16,128,1,f16:column,f16:row,f16:column,1,0,1,1,tensorop,f32,256,128,32,1,1,1,2,4,2,1,16,16,4,70,75,4384,8192,1,0.0107213,0.380824,0.764088
97,CUTLASS,gemm,cutlass_tensorop_s884gemm_f16_256x128_32x2_nt_align8,passed,success,universal,serial,32,128,1,f16:column,f16:row,f32:column,1,0,1,1,tensorop,f32,256,128,32,1,1,1,2,4,2,1,16,16,4,70,75,16704,16384,0,0.00954368,1.63006,1.71674
97,CUTLASS,gemm,cutlass_tensorop_f16_s884gemm_f16_256x128_32x2_nt_align8,passed,success,universal,serial,32,128,1,f16:column,f16:row,f16:column,1,0,1,1,tensorop,f32,256,128,32,1,1,1,2,4,2,1,16,16,4,70,75,8512,16384,1,0.010711,0.740116,1.52964
98,CUTLASS,gemm,cutlass_tensorop_s884gemm_f16_256x128_32x2_nt_align8,passed,success,universal,serial,64,128,1,f16:column,f16:row,f32:column,1,0,1,1,tensorop,f32,256,128,32,1,1,1,2,4,2,1,16,16,4,70,75,33152,32768,0,0.00974848,3.16718,3.36134
98,CUTLASS,gemm,cutlass_tensorop_f16_s884gemm_f16_256x128_32x2_nt_align8,passed,success,universal,serial,64,128,1,f16:column,f16:row,f16:column,1,0,1,1,tensorop,f32,256,128,32,1,1,1,2,4,2,1,16,16,4,70,75,16768,32768,1,0.0108851,1.43466,3.01035
99,CUTLASS,gemm,cutlass_tensorop_s884gemm_f16_256x128_32x2_nt_align8,passed,success,universal,serial,128,128,1,f16:column,f16:row,f32:column,1,0,1,1,tensorop,f32,256,128,32,1,1,1,2,4,2,1,16,16,4,70,75,66048,65536,0,0.0100454,6.12337,6.52396
99,CUTLASS,gemm,cutlass_tensorop_f16_s884gemm_f16_256x128_32x2_nt_align8,passed,success,universal,serial,128,128,1,f16:column,f16:row,f16:column,1,0,1,1,tensorop,f32,256,128,32,1,1,1,2,4,2,1,16,16,4,70,75,33280,65536,1,0.0109261,2.83674,5.99813
100,CUTLASS,gemm,cutlass_tensorop_s884gemm_f16_256x128_32x2_nt_align8,passed,success,universal,serial,256,128,1,f16:column,f16:row,f32:column,1,0,1,1,tensorop,f32,256,128,32,1,1,1,2,4,2,1,16,16,4,70,75,131840,131072,0,0.0101274,12.1241,12.9424
100,CUTLASS,gemm,cutlass_tensorop_f16_s884gemm_f16_256x128_32x2_nt_align8,passed,success,universal,serial,256,128,1,f16:column,f16:row,f16:column,1,0,1,1,tensorop,f32,256,128,32,1,1,1,2,4,2,1,16,16,4,70,75,66304,131072,1,0.0109568,5.63581,11.9626
101,CUTLASS,gemm,cutlass_tensorop_s884gemm_f16_256x128_32x2_nt_align8,passed,success,universal,serial,512,128,1,f16:column,f16:row,f32:column,1,0,1,1,tensorop,f32,256,128,32,1,1,1,2,4,2,1,16,16,4,70,75,263424,262144,0,0.0101478,24.1759,25.8325
101,CUTLASS,gemm,cutlass_tensorop_f16_s884gemm_f16_256x128_32x2_nt_align8,passed,success,universal,serial,512,128,1,f16:column,f16:row,f16:column,1,0,1,1,tensorop,f32,256,128,32,1,1,1,2,4,2,1,16,16,4,70,75,132352,262144,1,0.010967,11.2394,23.9029
102,CUTLASS,gemm,cutlass_tensorop_s884gemm_f16_256x128_32x2_nt_align8,passed,success,universal,serial,1024,128,1,f16:column,f16:row,f32:column,1,0,1,1,tensorop,f32,256,128,32,1,1,1,2,4,2,1,16,16,4,70,75,526592,524288,0,0.0102605,47.7977,51.0978
102,CUTLASS,gemm,cutlass_tensorop_f16_s884gemm_f16_256x128_32x2_nt_align8,passed,success,universal,serial,1024,128,1,f16:column,f16:row,f16:column,1,0,1,1,tensorop,f32,256,128,32,1,1,1,2,4,2,1,16,16,4,70,75,264448,524288,1,0.0110285,22.3319,47.5395
103,CUTLASS,gemm,cutlass_tensorop_s884gemm_f16_256x128_32x2_nt_align8,passed,success,universal,serial,2048,128,1,f16:column,f16:row,f32:column,1,0,1,1,tensorop,f32,256,128,32,1,1,1,2,4,2,1,16,16,4,70,75,1052928,1048576,0,0.0103526,94.7213,101.286
103,CUTLASS,gemm,cutlass_tensorop_f16_s884gemm_f16_256x128_32x2_nt_align8,passed,success,universal,serial,2048,128,1,f16:column,f16:row,f16:column,1,0,1,1,tensorop,f32,256,128,32,1,1,1,2,4,2,1,16,16,4,70,75,528640,1048576,1,0.0111309,44.2314,94.2042
104,CUTLASS,gemm,cutlass_tensorop_s884gemm_f16_256x128_32x2_nt_align8,passed,success,universal,serial,4096,128,1,f16:column,f16:row,f32:column,1,0,1,1,tensorop,f32,256,128,32,1,1,1,2,4,2,1,16,16,4,70,75,2105600,2097152,0,0.0103424,189.607,202.772
104,CUTLASS,gemm,cutlass_tensorop_f16_s884gemm_f16_256x128_32x2_nt_align8,passed,success,universal,serial,4096,128,1,f16:column,f16:row,f16:column,1,0,1,1,tensorop,f32,256,128,32,1,1,1,2,4,2,1,16,16,4,70,75,1057024,2097152,1,0.011264,87.3962,186.182
108,CUTLASS,gemm,cutlass_tensorop_s884gemm_f16_256x128_32x2_nt_align8,passed,success,universal,serial,8,256,1,f16:column,f16:row,f32:column,1,0,1,1,tensorop,f32,256,128,32,1,1,1,2,4,2,1,16,16,4,70,75,8720,8192,0,0.00953344,0.851858,0.859291
108,CUTLASS,gemm,cutlass_tensorop_f16_s884gemm_f16_256x128_32x2_nt_align8,passed,success,universal,serial,8,256,1,f16:column,f16:row,f16:column,1,0,1,1,tensorop,f32,256,128,32,1,1,1,2,4,2,1,16,16,4,70,75,4624,8192,1,0.0108851,0.395626,0.752587
109,CUTLASS,gemm,cutlass_tensorop_s884gemm_f16_256x128_32x2_nt_align8,passed,success,universal,serial,16,256,1,f16:column,f16:row,f32:column,1,0,1,1,tensorop,f32,256,128,32,1,1,1,2,4,2,1,16,16,4,70,75,16928,16384,0,0.0095744,1.64662,1.71123
109,CUTLASS,gemm,cutlass_tensorop_f16_s884gemm_f16_256x128_32x2_nt_align8,passed,success,universal,serial,16,256,1,f16:column,f16:row,f16:column,1,0,1,1,tensorop,f32,256,128,32,1,1,1,2,4,2,1,16,16,4,70,75,8736,16384,1,0.0109056,0.746042,1.50235
110,CUTLASS,gemm,cutlass_tensorop_s884gemm_f16_256x128_32x2_nt_align8,passed,success,universal,serial,32,256,1,f16:column,f16:row,f32:column,1,0,1,1,tensorop,f32,256,128,32,1,1,1,2,4,2,1,16,16,4,70,75,33344,32768,0,0.00974848,3.18552,3.36134
110,CUTLASS,gemm,cutlass_tensorop_f16_s884gemm_f16_256x128_32x2_nt_align8,passed,success,universal,serial,32,256,1,f16:column,f16:row,f16:column,1,0,1,1,tensorop,f32,256,128,32,1,1,1,2,4,2,1,16,16,4,70,75,16960,32768,1,0.0109363,1.44429,2.99625
111,CUTLASS,gemm,cutlass_tensorop_s884gemm_f16_256x128_32x2_nt_align8,passed,success,universal,serial,64,256,1,f16:column,f16:row,f32:column,1,0,1,1,tensorop,f32,256,128,32,1,1,1,2,4,2,1,16,16,4,70,75,66176,65536,0,0.0101376,6.07947,6.46465
111,CUTLASS,gemm,cutlass_tensorop_f16_s884gemm_f16_256x128_32x2_nt_align8,passed,success,universal,serial,64,256,1,f16:column,f16:row,f16:column,1,0,1,1,tensorop,f32,256,128,32,1,1,1,2,4,2,1,16,16,4,70,75,33408,65536,1,0.0109261,2.84765,5.99813
112,CUTLASS,gemm,cutlass_tensorop_s884gemm_f16_256x128_32x2_nt_align8,passed,success,universal,serial,128,256,1,f16:column,f16:row,f32:column,1,0,1,1,tensorop,f32,256,128,32,1,1,1,2,4,2,1,16,16,4,70,75,131840,131072,0,0.010967,11.1959,11.9514
112,CUTLASS,gemm,cutlass_tensorop_f16_s884gemm_f16_256x128_32x2_nt_align8,passed,success,universal,serial,128,256,1,f16:column,f16:row,f16:column,1,0,1,1,tensorop,f32,256,128,32,1,1,1,2,4,2,1,16,16,4,70,75,66304,131072,1,0.0113971,5.41807,11.5004
113,CUTLASS,gemm,cutlass_tensorop_s884gemm_f16_256x128_32x2_nt_align8,passed,success,universal,serial,256,256,1,f16:column,f16:row,f32:column,1,0,1,1,tensorop,f32,256,128,32,1,1,1,2,4,2,1,16,16,4,70,75,263168,262144,0,0.010967,22.3483,23.9029
113,CUTLASS,gemm,cutlass_tensorop_f16_s884gemm_f16_256x128_32x2_nt_align8,passed,success,universal,serial,256,256,1,f16:column,f16:row,f16:column,1,0,1,1,tensorop,f32,256,128,32,1,1,1,2,4,2,1,16,16,4,70,75,132096,262144,1,0.0114074,10.7846,22.9803
114,CUTLASS,gemm,cutlass_tensorop_s884gemm_f16_256x128_32x2_nt_align8,passed,success,universal,serial,512,256,1,f16:column,f16:row,f32:column,1,0,1,1,tensorop,f32,256,128,32,1,1,1,2,4,2,1,16,16,4,70,75,525824,524288,0,0.011049,44.322,47.4513
114,CUTLASS,gemm,cutlass_tensorop_f16_s884gemm_f16_256x128_32x2_nt_align8,passed,success,universal,serial,512,256,1,f16:column,f16:row,f16:column,1,0,1,1,tensorop,f32,256,128,32,1,1,1,2,4,2,1,16,16,4,70,75,263680,524288,1,0.0114483,21.4504,45.7961
115,CUTLASS,gemm,cutlass_tensorop_s884gemm_f16_256x128_32x2_nt_align8,passed,success,universal,serial,1024,256,1,f16:column,f16:row,f32:column,1,0,1,1,tensorop,f32,256,128,32,1,1,1,2,4,2,1,16,16,4,70,75,1051136,1048576,0,0.0111821,87.546,93.7729
115,CUTLASS,gemm,cutlass_tensorop_f16_s884gemm_f16_256x128_32x2_nt_align8,passed,success,universal,serial,1024,256,1,f16:column,f16:row,f16:column,1,0,1,1,tensorop,f32,256,128,32,1,1,1,2,4,2,1,16,16,4,70,75,526848,1048576,1,0.0114995,42.6683,91.1843
116,CUTLASS,gemm,cutlass_tensorop_s884gemm_f16_256x128_32x2_nt_align8,passed,success,universal,serial,2048,256,1,f16:column,f16:row,f32:column,1,0,1,1,tensorop,f32,256,128,32,1,1,1,2,4,2,1,16,16,4,70,75,2101760,2097152,0,0.011049,177.158,189.805
116,CUTLASS,gemm,cutlass_tensorop_f16_s884gemm_f16_256x128_32x2_nt_align8,passed,success,universal,serial,2048,256,1,f16:column,f16:row,f16:column,1,0,1,1,tensorop,f32,256,128,32,1,1,1,2,4,2,1,16,16,4,70,75,1053184,2097152,1,0.0116838,83.9496,179.492
117,CUTLASS,gemm,cutlass_tensorop_s884gemm_f16_256x128_32x2_nt_align8,passed,success,universal,serial,4096,256,1,f16:column,f16:row,f32:column,1,0,1,1,tensorop,f32,256,128,32,1,1,1,2,4,2,1,16,16,4,70,75,4203008,4194304,0,0.011223,348.779,373.723
117,CUTLASS,gemm,cutlass_tensorop_f16_s884gemm_f16_256x128_32x2_nt_align8,passed,success,universal,serial,4096,256,1,f16:column,f16:row,f16:column,1,0,1,1,tensorop,f32,256,128,32,1,1,1,2,4,2,1,16,16,4,70,75,2105856,4194304,1,0.0116224,168.746,360.881
121,CUTLASS,gemm,cutlass_tensorop_s884gemm_f16_256x128_32x2_nt_align8,passed,success,universal,serial,8,512,1,f16:column,f16:row,f32:column,1,0,1,1,tensorop,f32,256,128,32,1,1,1,2,4,2,1,16,16,4,70,75,17424,16384,0,0.00956416,1.69668,1.71306
121,CUTLASS,gemm,cutlass_tensorop_f16_s884gemm_f16_256x128_32x2_nt_align8,passed,success,universal,serial,8,512,1,f16:column,f16:row,f16:column,1,0,1,1,tensorop,f32,256,128,32,1,1,1,2,4,2,1,16,16,4,70,75,9232,16384,1,0.0108851,0.789883,1.50517
122,CUTLASS,gemm,cutlass_tensorop_s884gemm_f16_256x128_32x2_nt_align8,passed,success,universal,serial,16,512,1,f16:column,f16:row,f32:column,1,0,1,1,tensorop,f32,256,128,32,1,1,1,2,4,2,1,16,16,4,70,75,33824,32768,0,0.00955392,3.29719,3.4298
122,CUTLASS,gemm,cutlass_tensorop_f16_s884gemm_f16_256x128_32x2_nt_align8,passed,success,universal,serial,16,512,1,f16:column,f16:row,f16:column,1,0,1,1,tensorop,f32,256,128,32,1,1,1,2,4,2,1,16,16,4,70,75,17440,32768,1,0.0109158,1.48795,3.00188
123,CUTLASS,gemm,cutlass_tensorop_s884gemm_f16_256x128_32x2_nt_align8,passed,success,universal,serial,32,512,1,f16:column,f16:row,f32:column,1,0,1,1,tensorop,f32,256,128,32,1,1,1,2,4,2,1,16,16,4,70,75,66624,65536,0,0.00976896,6.35159,6.7086
123,CUTLASS,gemm,cutlass_tensorop_f16_s884gemm_f16_256x128_32x2_nt_align8,passed,success,universal,serial,32,512,1,f16:column,f16:row,f16:column,1,0,1,1,tensorop,f32,256,128,32,1,1,1,2,4,2,1,16,16,4,70,75,33856,65536,1,0.0109261,2.88583,5.99813
124,CUTLASS,gemm,cutlass_tensorop_s884gemm_f16_256x128_32x2_nt_align8,passed,success,universal,serial,64,512,1,f16:column,f16:row,f32:column,1,0,1,1,tensorop,f32,256,128,32,1,1,1,2,4,2,1,16,16,4,70,75,132224,131072,0,0.0101274,12.1595,12.9424
124,CUTLASS,gemm,cutlass_tensorop_f16_s884gemm_f16_256x128_32x2_nt_align8,passed,success,universal,serial,64,512,1,f16:column,f16:row,f16:column,1,0,1,1,tensorop,f32,256,128,32,1,1,1,2,4,2,1,16,16,4,70,75,66688,131072,1,0.0109466,5.67375,11.9738
125,CUTLASS,gemm,cutlass_tensorop_s884gemm_f16_256x128_32x2_nt_align8,passed,success,universal,serial,128,512,1,f16:column,f16:row,f32:column,1,0,1,1,tensorop,f32,256,128,32,1,1,1,2,4,2,1,16,16,4,70,75,263424,262144,0,0.0109773,22.3491,23.8806
125,CUTLASS,gemm,cutlass_tensorop_f16_s884gemm_f16_256x128_32x2_nt_align8,passed,success,universal,serial,128,512,1,f16:column,f16:row,f16:column,1,0,1,1,tensorop,f32,256,128,32,1,1,1,2,4,2,1,16,16,4,70,75,132352,262144,1,0.0114278,10.7862,22.9391
126,CUTLASS,gemm,cutlass_tensorop_s884gemm_f16_256x128_32x2_nt_align8,passed,success,universal,serial,256,512,1,f16:column,f16:row,f32:column,1,0,1,1,tensorop,f32,256,128,32,1,1,1,2,4,2,1,16,16,4,70,75,525824,524288,0,0.0110592,44.2809,47.4074
126,CUTLASS,gemm,cutlass_tensorop_f16_s884gemm_f16_256x128_32x2_nt_align8,passed,success,universal,serial,256,512,1,f16:column,f16:row,f16:column,1,0,1,1,tensorop,f32,256,128,32,1,1,1,2,4,2,1,16,16,4,70,75,263680,524288,1,0.0114893,21.3739,45.6328
127,CUTLASS,gemm,cutlass_tensorop_s884gemm_f16_256x128_32x2_nt_align8,passed,success,universal,serial,512,512,1,f16:column,f16:row,f32:column,1,0,1,1,tensorop,f32,256,128,32,1,1,1,2,4,2,1,16,16,4,70,75,1050624,1048576,0,0.0111206,87.9868,94.291
127,CUTLASS,gemm,cutlass_tensorop_f16_s884gemm_f16_256x128_32x2_nt_align8,passed,success,universal,serial,512,512,1,f16:column,f16:row,f16:column,1,0,1,1,tensorop,f32,256,128,32,1,1,1,2,4,2,1,16,16,4,70,75,526336,1048576,1,0.0115507,42.4379,90.7801
128,CUTLASS,gemm,cutlass_tensorop_s884gemm_f16_256x128_32x2_nt_align8,passed,success,universal,serial,1024,512,1,f16:column,f16:row,f32:column,1,0,1,1,tensorop,f32,256,128,32,1,1,1,2,4,2,1,16,16,4,70,75,2100224,2097152,0,0.0113254,172.707,185.172
128,CUTLASS,gemm,cutlass_tensorop_f16_s884gemm_f16_256x128_32x2_nt_align8,passed,success,universal,serial,1024,512,1,f16:column,f16:row,f16:column,1,0,1,1,tensorop,f32,256,128,32,1,1,1,2,4,2,1,16,16,4,70,75,1051648,2097152,1,0.0115712,84.6432,181.239
129,CUTLASS,gemm,cutlass_tensorop_s884gemm_f16_256x128_32x2_nt_align8,passed,success,universal,serial,2048,512,1,f16:column,f16:row,f32:column,1,0,1,1,tensorop,f32,256,128,32,1,1,1,2,4,2,1,16,16,4,70,75,4199424,4194304,0,0.0126566,309.009,331.392
129,CUTLASS,gemm,cutlass_tensorop_f16_s884gemm_f16_256x128_32x2_nt_align8,passed,success,universal,serial,2048,512,1,f16:column,f16:row,f16:column,1,0,1,1,tensorop,f32,256,128,32,1,1,1,2,4,2,1,16,16,4,70,75,2102272,4194304,1,0.011817,165.685,354.939
130,CUTLASS,gemm,cutlass_tensorop_s884gemm_f16_256x128_32x2_nt_align8,passed,success,universal,serial,4096,512,1,f16:column,f16:row,f32:column,1,0,1,1,tensorop,f32,256,128,32,1,1,1,2,4,2,1,16,16,4,70,75,8397824,8388608,0,0.0155136,504.144,540.726
130,CUTLASS,gemm,cutlass_tensorop_f16_s884gemm_f16_256x128_32x2_nt_align8,passed,success,universal,serial,4096,512,1,f16:column,f16:row,f16:column,1,0,1,1,tensorop,f32,256,128,32,1,1,1,2,4,2,1,16,16,4,70,75,4203520,8388608,1,0.0130458,300.085,643.014
134,CUTLASS,gemm,cutlass_tensorop_s884gemm_f16_256x128_32x2_nt_align8,passed,success,universal,serial,8,1024,1,f16:column,f16:row,f32:column,1,0,1,1,tensorop,f32,256,128,32,1,1,1,2,4,2,1,16,16,4,70,75,34832,32768,0,0.0095744,3.38818,3.42246
134,CUTLASS,gemm,cutlass_tensorop_f16_s884gemm_f16_256x128_32x2_nt_align8,passed,success,universal,serial,8,1024,1,f16:column,f16:row,f16:column,1,0,1,1,tensorop,f32,256,128,32,1,1,1,2,4,2,1,16,16,4,70,75,18448,32768,1,0.0108954,1.57691,3.00752
135,CUTLASS,gemm,cutlass_tensorop_s884gemm_f16_256x128_32x2_nt_align8,passed,success,universal,serial,16,1024,1,f16:column,f16:row,f32:column,1,0,1,1,tensorop,f32,256,128,32,1,1,1,2,4,2,1,16,16,4,70,75,67616,65536,0,0.0095744,6.57715,6.84492
135,CUTLASS,gemm,cutlass_tensorop_f16_s884gemm_f16_256x128_32x2_nt_align8,passed,success,universal,serial,16,1024,1,f16:column,f16:row,f16:column,1,0,1,1,tensorop,f32,256,128,32,1,1,1,2,4,2,1,16,16,4,70,75,34848,65536,1,0.0109466,2.96483,5.9869
136,CUTLASS,gemm,cutlass_tensorop_s884gemm_f16_256x128_32x2_nt_align8,passed,success,universal,serial,32,1024,1,f16:column,f16:row,f32:column,1,0,1,1,tensorop,f32,256,128,32,1,1,1,2,4,2,1,16,16,4,70,75,133184,131072,0,0.00980992,12.6441,13.3612
136,CUTLASS,gemm,cutlass_tensorop_f16_s884gemm_f16_256x128_32x2_nt_align8,passed,success,universal,serial,32,1024,1,f16:column,f16:row,f16:column,1,0,1,1,tensorop,f32,256,128,32,1,1,1,2,4,2,1,16,16,4,70,75,67648,131072,1,0.0109363,5.76081,11.985
137,CUTLASS,gemm,cutlass_tensorop_s884gemm_f16_256x128_32x2_nt_align8,passed,success,universal,serial,64,1024,1,f16:column,f16:row,f32:column,1,0,1,1,tensorop,f32,256,128,32,1,1,1,2,4,2,1,16,16,4,70,75,264320,262144,0,0.0101786,24.1849,25.7545
137,CUTLASS,gemm,cutlass_tensorop_f16_s884gemm_f16_256x128_32x2_nt_align8,passed,success,universal,serial,64,1024,1,f16:column,f16:row,f16:column,1,0,1,1,tensorop,f32,256,128,32,1,1,1,2,4,2,1,16,16,4,70,75,133248,262144,1,0.011008,11.2733,23.814
138,CUTLASS,gemm,cutlass_tensorop_s884gemm_f16_256x128_32x2_nt_align8,passed,success,universal,serial,128,1024,1,f16:column,f16:row,f32:column,1,0,1,1,tensorop,f32,256,128,32,1,1,1,2,4,2,1,16,16,4,70,75,526592,524288,0,0.0110797,44.2636,47.3198
138,CUTLASS,gemm,cutlass_tensorop_f16_s884gemm_f16_256x128_32x2_nt_align8,passed,success,universal,serial,128,1024,1,f16:column,f16:row,f16:column,1,0,1,1,tensorop,f32,256,128,32,1,1,1,2,4,2,1,16,16,4,70,75,264448,524288,1,0.0114483,21.5129,45.7961
139,CUTLASS,gemm,cutlass_tensorop_s884gemm_f16_256x128_32x2_nt_align8,passed,success,universal,serial,256,1024,1,f16:column,f16:row,f32:column,1,0,1,1,tensorop,f32,256,128,32,1,1,1,2,4,2,1,16,16,4,70,75,1051136,1048576,0,0.0111411,87.8679,94.1176
139,CUTLASS,gemm,cutlass_tensorop_f16_s884gemm_f16_256x128_32x2_nt_align8,passed,success,universal,serial,256,1024,1,f16:column,f16:row,f16:column,1,0,1,1,tensorop,f32,256,128,32,1,1,1,2,4,2,1,16,16,4,70,75,526848,1048576,1,0.0115405,42.5169,90.8607
140,CUTLASS,gemm,cutlass_tensorop_s884gemm_f16_256x128_32x2_nt_align8,passed,success,universal,serial,512,1024,1,f16:column,f16:row,f32:column,1,0,1,1,tensorop,f32,256,128,32,1,1,1,2,4,2,1,16,16,4,70,75,2100224,2097152,0,0.011305,173.02,185.507
140,CUTLASS,gemm,cutlass_tensorop_f16_s884gemm_f16_256x128_32x2_nt_align8,passed,success,universal,serial,512,1024,1,f16:column,f16:row,f16:column,1,0,1,1,tensorop,f32,256,128,32,1,1,1,2,4,2,1,16,16,4,70,75,1051648,2097152,1,0.0116326,84.1961,180.282
141,CUTLASS,gemm,cutlass_tensorop_s884gemm_f16_256x128_32x2_nt_align8,passed,success,universal,serial,1024,1024,1,f16:column,f16:row,f32:column,1,0,1,1,tensorop,f32,256,128,32,1,1,1,2,4,2,1,16,16,4,70,75,4198400,4194304,0,0.0111616,350.314,375.78
141,CUTLASS,gemm,cutlass_tensorop_f16_s884gemm_f16_256x128_32x2_nt_align8,passed,success,universal,serial,1024,1024,1,f16:column,f16:row,f16:column,1,0,1,1,tensorop,f32,256,128,32,1,1,1,2,4,2,1,16,16,4,70,75,2101248,4194304,1,0.0118067,165.748,355.247
142,CUTLASS,gemm,cutlass_tensorop_s884gemm_f16_256x128_32x2_nt_align8,passed,success,universal,serial,2048,1024,1,f16:column,f16:row,f32:column,1,0,1,1,tensorop,f32,256,128,32,1,1,1,2,4,2,1,16,16,4,70,75,8394752,8388608,0,0.0152474,512.759,550.168
142,CUTLASS,gemm,cutlass_tensorop_f16_s884gemm_f16_256x128_32x2_nt_align8,passed,success,universal,serial,2048,1024,1,f16:column,f16:row,f16:column,1,0,1,1,tensorop,f32,256,128,32,1,1,1,2,4,2,1,16,16,4,70,75,4200448,8388608,1,0.0120218,325.408,697.785
143,CUTLASS,gemm,cutlass_tensorop_s884gemm_f16_256x128_32x2_nt_align8,passed,success,universal,serial,4096,1024,1,f16:column,f16:row,f32:column,1,0,1,1,tensorop,f32,256,128,32,1,1,1,2,4,2,1,16,16,4,70,75,16787456,16777216,0,0.0277914,562.568,603.685
143,CUTLASS,gemm,cutlass_tensorop_f16_s884gemm_f16_256x128_32x2_nt_align8,passed,success,universal,serial,4096,1024,1,f16:column,f16:row,f16:column,1,0,1,1,tensorop,f32,256,128,32,1,1,1,2,4,2,1,16,16,4,70,75,8398848,16777216,1,0.0219546,356.283,764.179
147,CUTLASS,gemm,cutlass_tensorop_s884gemm_f16_256x128_32x2_nt_align8,passed,success,universal,serial,8,2048,1,f16:column,f16:row,f32:column,1,0,1,1,tensorop,f32,256,128,32,1,1,1,2,4,2,1,16,16,4,70,75,69648,65536,0,0.0095744,6.77481,6.84492
147,CUTLASS,gemm,cutlass_tensorop_f16_s884gemm_f16_256x128_32x2_nt_align8,passed,success,universal,serial,8,2048,1,f16:column,f16:row,f16:column,1,0,1,1,tensorop,f32,256,128,32,1,1,1,2,4,2,1,16,16,4,70,75,36880,65536,1,0.0108749,3.1584,6.02637
148,CUTLASS,gemm,cutlass_tensorop_s884gemm_f16_256x128_32x2_nt_align8,passed,success,universal,serial,16,2048,1,f16:column,f16:row,f32:column,1,0,1,1,tensorop,f32,256,128,32,1,1,1,2,4,2,1,16,16,4,70,75,135200,131072,0,0.00961536,13.0952,13.6315
148,CUTLASS,gemm,cutlass_tensorop_f16_s884gemm_f16_256x128_32x2_nt_align8,passed,success,universal,serial,16,2048,1,f16:column,f16:row,f16:column,1,0,1,1,tensorop,f32,256,128,32,1,1,1,2,4,2,1,16,16,4,70,75,69664,131072,1,0.0109363,5.93249,11.985
149,CUTLASS,gemm,cutlass_tensorop_s884gemm_f16_256x128_32x2_nt_align8,passed,success,universal,serial,32,2048,1,f16:column,f16:row,f32:column,1,0,1,1,tensorop,f32,256,128,32,1,1,1,2,4,2,1,16,16,4,70,75,266304,262144,0,0.00980992,25.2821,26.7223
149,CUTLASS,gemm,cutlass_tensorop_f16_s884gemm_f16_256x128_32x2_nt_align8,passed,success,universal,serial,32,2048,1,f16:column,f16:row,f16:column,1,0,1,1,tensorop,f32,256,128,32,1,1,1,2,4,2,1,16,16,4,70,75,135232,262144,1,0.0109875,11.4625,23.8583
150,CUTLASS,gemm,cutlass_tensorop_s884gemm_f16_256x128_32x2_nt_align8,passed,success,universal,serial,64,2048,1,f16:column,f16:row,f32:column,1,0,1,1,tensorop,f32,256,128,32,1,1,1,2,4,2,1,16,16,4,70,75,528512,524288,0,0.0102195,48.1642,51.3026
150,CUTLASS,gemm,cutlass_tensorop_f16_s884gemm_f16_256x128_32x2_nt_align8,passed,success,universal,serial,64,2048,1,f16:column,f16:row,f16:column,1,0,1,1,tensorop,f32,256,128,32,1,1,1,2,4,2,1,16,16,4,70,75,266368,524288,1,0.0110592,22.4315,47.4074
151,CUTLASS,gemm,cutlass_tensorop_s884gemm_f16_256x128_32x2_nt_align8,passed,success,universal,serial,128,2048,1,f16:column,f16:row,f32:column,1,0,1,1,tensorop,f32,256,128,32,1,1,1,2,4,2,1,16,16,4,70,75,1052928,1048576,0,0.0111923,87.615,93.6871
151,CUTLASS,gemm,cutlass_tensorop_f16_s884gemm_f16_256x128_32x2_nt_align8,passed,success,universal,serial,128,2048,1,f16:column,f16:row,f16:column,1,0,1,1,tensorop,f32,256,128,32,1,1,1,2,4,2,1,16,16,4,70,75,528640,1048576,1,0.0115302,42.6994,90.9414
152,CUTLASS,gemm,cutlass_tensorop_s884gemm_f16_256x128_32x2_nt_align8,passed,success,universal,serial,256,2048,1,f16:column,f16:row,f32:column,1,0,1,1,tensorop,f32,256,128,32,1,1,1,2,4,2,1,16,16,4,70,75,2101760,2097152,0,0.0111411,175.693,188.235
152,CUTLASS,gemm,cutlass_tensorop_f16_s884gemm_f16_256x128_32x2_nt_align8,passed,success,universal,serial,256,2048,1,f16:column,f16:row,f16:column,1,0,1,1,tensorop,f32,256,128,32,1,1,1,2,4,2,1,16,16,4,70,75,1053184,2097152,1,0.0116634,84.097,179.807
153,CUTLASS,gemm,cutlass_tensorop_s884gemm_f16_256x128_32x2_nt_align8,passed,success,universal,serial,512,2048,1,f16:column,f16:row,f32:column,1,0,1,1,tensorop,f32,256,128,32,1,1,1,2,4,2,1,16,16,4,70,75,4199424,4194304,0,0.011264,347.214,372.364
153,CUTLASS,gemm,cutlass_tensorop_f16_s884gemm_f16_256x128_32x2_nt_align8,passed,success,universal,serial,512,2048,1,f16:column,f16:row,f16:column,1,0,1,1,tensorop,f32,256,128,32,1,1,1,2,4,2,1,16,16,4,70,75,2102272,4194304,1,0.0117146,167.133,358.042
154,CUTLASS,gemm,cutlass_tensorop_s884gemm_f16_256x128_32x2_nt_align8,passed,success,universal,serial,1024,2048,1,f16:column,f16:row,f32:column,1,0,1,1,tensorop,f32,256,128,32,1,1,1,2,4,2,1,16,16,4,70,75,8394752,8388608,0,0.0152781,511.728,549.062
154,CUTLASS,gemm,cutlass_tensorop_f16_s884gemm_f16_256x128_32x2_nt_align8,passed,success,universal,serial,1024,2048,1,f16:column,f16:row,f16:column,1,0,1,1,tensorop,f32,256,128,32,1,1,1,2,4,2,1,16,16,4,70,75,4200448,8388608,1,0.0119706,326.799,700.77
155,CUTLASS,gemm,cutlass_tensorop_s884gemm_f16_256x128_32x2_nt_align8,passed,success,universal,serial,2048,2048,1,f16:column,f16:row,f32:column,1,0,1,1,tensorop,f32,256,128,32,1,1,1,2,4,2,1,16,16,4,70,75,16785408,16777216,0,0.0288051,542.703,582.439
155,CUTLASS,gemm,cutlass_tensorop_f16_s884gemm_f16_256x128_32x2_nt_align8,passed,success,universal,serial,2048,2048,1,f16:column,f16:row,f16:column,1,0,1,1,tensorop,f32,256,128,32,1,1,1,2,4,2,1,16,16,4,70,75,8396800,16777216,1,0.0218112,358.537,769.202
156,CUTLASS,gemm,cutlass_tensorop_s884gemm_f16_256x128_32x2_nt_align8,passed,success,universal,serial,4096,2048,1,f16:column,f16:row,f32:column,1,0,1,1,tensorop,f32,256,128,32,1,1,1,2,4,2,1,16,16,4,70,75,33566720,33554432,0,0.0510362,612.535,657.464
156,CUTLASS,gemm,cutlass_tensorop_f16_s884gemm_f16_256x128_32x2_nt_align8,passed,success,universal,serial,4096,2048,1,f16:column,f16:row,f16:column,1,0,1,1,tensorop,f32,256,128,32,1,1,1,2,4,2,1,16,16,4,70,75,16789504,33554432,1,0.0410522,380.892,817.361
160,CUTLASS,gemm,cutlass_tensorop_s884gemm_f16_256x128_32x2_nt_align8,passed,success,universal,serial,8,4096,1,f16:column,f16:row,f32:column,1,0,1,1,tensorop,f32,256,128,32,1,1,1,2,4,2,1,16,16,4,70,75,139280,131072,0,0.0095744,13.5481,13.6898
160,CUTLASS,gemm,cutlass_tensorop_f16_s884gemm_f16_256x128_32x2_nt_align8,passed,success,universal,serial,8,4096,1,f16:column,f16:row,f16:column,1,0,1,1,tensorop,f32,256,128,32,1,1,1,2,4,2,1,16,16,4,70,75,73744,131072,1,0.0108442,6.33331,12.0869
161,CUTLASS,gemm,cutlass_tensorop_s884gemm_f16_256x128_32x2_nt_align8,passed,success,universal,serial,16,4096,1,f16:column,f16:row,f32:column,1,0,1,1,tensorop,f32,256,128,32,1,1,1,2,4,2,1,16,16,4,70,75,270368,262144,0,0.00968704,25.9935,27.0613
161,CUTLASS,gemm,cutlass_tensorop_f16_s884gemm_f16_256x128_32x2_nt_align8,passed,success,universal,serial,16,4096,1,f16:column,f16:row,f16:column,1,0,1,1,tensorop,f32,256,128,32,1,1,1,2,4,2,1,16,16,4,70,75,139296,262144,1,0.0109568,11.8401,23.9252
162,CUTLASS,gemm,cutlass_tensorop_s884gemm_f16_256x128_32x2_nt_align8,passed,success,universal,serial,32,4096,1,f16:column,f16:row,f32:column,1,0,1,1,tensorop,f32,256,128,32,1,1,1,2,4,2,1,16,16,4,70,75,532544,524288,0,0.00984064,50.4002,53.2778
162,CUTLASS,gemm,cutlass_tensorop_f16_s884gemm_f16_256x128_32x2_nt_align8,passed,success,universal,serial,32,4096,1,f16:column,f16:row,f16:column,1,0,1,1,tensorop,f32,256,128,32,1,1,1,2,4,2,1,16,16,4,70,75,270400,524288,1,0.0109978,22.8983,47.6723
163,CUTLASS,gemm,cutlass_tensorop_s884gemm_f16_256x128_32x2_nt_align8,passed,success,universal,serial,64,4096,1,f16:column,f16:row,f32:column,1,0,1,1,tensorop,f32,256,128,32,1,1,1,2,4,2,1,16,16,4,70,75,1056896,1048576,0,0.0104038,94.6104,100.787
163,CUTLASS,gemm,cutlass_tensorop_f16_s884gemm_f16_256x128_32x2_nt_align8,passed,success,universal,serial,64,4096,1,f16:column,f16:row,f16:column,1,0,1,1,tensorop,f32,256,128,32,1,1,1,2,4,2,1,16,16,4,70,75,532608,1048576,1,0.0111309,44.5634,94.2042
164,CUTLASS,gemm,cutlass_tensorop_s884gemm_f16_256x128_32x2_nt_align8,passed,success,universal,serial,128,4096,1,f16:column,f16:row,f32:column,1,0,1,1,tensorop,f32,256,128,32,1,1,1,2,4,2,1,16,16,4,70,75,2105600,2097152,0,0.0111616,175.691,187.89
164,CUTLASS,gemm,cutlass_tensorop_f16_s884gemm_f16_256x128_32x2_nt_align8,passed,success,universal,serial,128,4096,1,f16:column,f16:row,f16:column,1,0,1,1,tensorop,f32,256,128,32,1,1,1,2,4,2,1,16,16,4,70,75,1057024,2097152,1,0.0116224,84.7011,180.441
165,CUTLASS,gemm,cutlass_tensorop_s884gemm_f16_256x128_32x2_nt_align8,passed,success,universal,serial,256,4096,1,f16:column,f16:row,f32:column,1,0,1,1,tensorop,f32,256,128,32,1,1,1,2,4,2,1,16,16,4,70,75,4203008,4194304,0,0.0112333,348.461,373.382
165,CUTLASS,gemm,cutlass_tensorop_f16_s884gemm_f16_256x128_32x2_nt_align8,passed,success,universal,serial,256,4096,1,f16:column,f16:row,f16:column,1,0,1,1,tensorop,f32,256,128,32,1,1,1,2,4,2,1,16,16,4,70,75,2105856,4194304,1,0.0116429,168.449,360.246
166,CUTLASS,gemm,cutlass_tensorop_s884gemm_f16_256x128_32x2_nt_align8,passed,success,universal,serial,512,4096,1,f16:column,f16:row,f32:column,1,0,1,1,tensorop,f32,256,128,32,1,1,1,2,4,2,1,16,16,4,70,75,8397824,8388608,0,0.0154726,505.478,542.158
166,CUTLASS,gemm,cutlass_tensorop_f16_s884gemm_f16_256x128_32x2_nt_align8,passed,success,universal,serial,512,4096,1,f16:column,f16:row,f16:column,1,0,1,1,tensorop,f32,256,128,32,1,1,1,2,4,2,1,16,16,4,70,75,4203520,8388608,1,0.0119808,326.759,700.171
167,CUTLASS,gemm,cutlass_tensorop_s884gemm_f16_256x128_32x2_nt_align8,passed,success,universal,serial,1024,4096,1,f16:column,f16:row,f32:column,1,0,1,1,tensorop,f32,256,128,32,1,1,1,2,4,2,1,16,16,4,70,75,16787456,16777216,0,0.0282931,552.591,592.979
167,CUTLASS,gemm,cutlass_tensorop_f16_s884gemm_f16_256x128_32x2_nt_align8,passed,success,universal,serial,1024,4096,1,f16:column,f16:row,f16:column,1,0,1,1,tensorop,f32,256,128,32,1,1,1,2,4,2,1,16,16,4,70,75,8398848,16777216,1,0.0220979,353.972,759.222
168,CUTLASS,gemm,cutlass_tensorop_s884gemm_f16_256x128_32x2_nt_align8,passed,success,universal,serial,2048,4096,1,f16:column,f16:row,f32:column,1,0,1,1,tensorop,f32,256,128,32,1,1,1,2,4,2,1,16,16,4,70,75,33566720,33554432,0,0.0507085,616.493,661.712
168,CUTLASS,gemm,cutlass_tensorop_f16_s884gemm_f16_256x128_32x2_nt_align8,passed,success,universal,serial,2048,4096,1,f16:column,f16:row,f16:column,1,0,1,1,tensorop,f32,256,128,32,1,1,1,2,4,2,1,16,16,4,70,75,16789504,33554432,1,0.0417997,374.08,802.744
169,CUTLASS,gemm,cutlass_tensorop_s884gemm_f16_256x128_32x2_nt_align8,passed,success,universal,serial,4096,4096,1,f16:column,f16:row,f32:column,1,0,1,1,tensorop,f32,256,128,32,1,1,1,2,4,2,1,16,16,4,70,75,67125248,67108864,0,0.087849,711.622,763.912
169,CUTLASS,gemm,cutlass_tensorop_f16_s884gemm_f16_256x128_32x2_nt_align8,passed,success,universal,serial,4096,4096,1,f16:column,f16:row,f16:column,1,0,1,1,tensorop,f32,256,128,32,1,1,1,2,4,2,1,16,16,4,70,75,33570816,67108864,1,0.0714752,437.428,938.911
212,CUTLASS,gemm,cutlass_tensorop_s884gemm_f16_256x128_32x2_nt_align8,passed,success,universal,serial,8,8,2,f16:column,f16:row,f32:column,1,0,1,1,tensorop,f32,256,128,32,1,1,1,2,4,2,1,16,16,4,70,75,320,384,1,0.0093184,0.0319822,0.0412088
212,CUTLASS,gemm,cutlass_tensorop_f16_s884gemm_f16_256x128_32x2_nt_align8,passed,success,universal,serial,8,8,2,f16:column,f16:row,f16:column,1,0,1,1,tensorop,f32,256,128,32,1,1,1,2,4,2,1,16,16,4,70,75,192,384,2,0.0106906,0.0167263,0.0359195
213,CUTLASS,gemm,cutlass_tensorop_s884gemm_f16_256x128_32x2_nt_align8,passed,success,universal,serial,16,8,2,f16:column,f16:row,f32:column,1,0,1,1,tensorop,f32,256,128,32,1,1,1,2,4,2,1,16,16,4,70,75,608,768,1,0.0093184,0.0607662,0.0824176
213,CUTLASS,gemm,cutlass_tensorop_f16_s884gemm_f16_256x128_32x2_nt_align8,passed,success,universal,serial,16,8,2,f16:column,f16:row,f16:column,1,0,1,1,tensorop,f32,256,128,32,1,1,1,2,4,2,1,16,16,4,70,75,352,768,2,0.0106906,0.030665,0.0718391
214,CUTLASS,gemm,cutlass_tensorop_s884gemm_f16_256x128_32x2_nt_align8,passed,success,universal,serial,32,8,2,f16:column,f16:row,f32:column,1,0,1,1,tensorop,f32,256,128,32,1,1,1,2,4,2,1,16,16,4,70,75,1184,1536,1,0.0093184,0.118334,0.164835
214,CUTLASS,gemm,cutlass_tensorop_f16_s884gemm_f16_256x128_32x2_nt_align8,passed,success,universal,serial,32,8,2,f16:column,f16:row,f16:column,1,0,1,1,tensorop,f32,256,128,32,1,1,1,2,4,2,1,16,16,4,70,75,672,1536,2,0.0106906,0.0585422,0.143678
215,CUTLASS,gemm,cutlass_tensorop_s884gemm_f16_256x128_32x2_nt_align8,passed,success,universal,serial,64,8,2,f16:column,f16:row,f32:column,1,0,1,1,tensorop,f32,256,128,32,1,1,1,2,4,2,1,16,16,4,70,75,2336,3072,1,0.00932864,0.233214,0.329308
215,CUTLASS,gemm,cutlass_tensorop_f16_s884gemm_f16_256x128_32x2_nt_align8,passed,success,universal,serial,64,8,2,f16:column,f16:row,f16:column,1,0,1,1,tensorop,f32,256,128,32,1,1,1,2,4,2,1,16,16,4,70,75,1312,3072,2,0.0106906,0.114297,0.287356
216,CUTLASS,gemm,cutlass_tensorop_s884gemm_f16_256x128_32x2_nt_align8,passed,success,universal,serial,128,8,2,f16:column,f16:row,f32:column,1,0,1,1,tensorop,f32,256,128,32,1,1,1,2,4,2,1,16,16,4,70,75,4640,6144,1,0.00939008,0.460202,0.654308
216,CUTLASS,gemm,cutlass_tensorop_f16_s884gemm_f16_256x128_32x2_nt_align8,passed,success,universal,serial,128,8,2,f16:column,f16:row,f16:column,1,0,1,1,tensorop,f32,256,128,32,1,1,1,2,4,2,1,16,16,4,70,75,2592,6144,2,0.0106906,0.225806,0.574713
217,CUTLASS,gemm,cutlass_tensorop_s884gemm_f16_256x128_32x2_nt_align8,passed,success,universal,serial,256,8,2,f16:column,f16:row,f32:column,1,0,1,1,tensorop,f32,256,128,32,1,1,1,2,4,2,1,16,16,4,70,75,9248,12288,1,0.00937984,0.918232,1.31004
217,CUTLASS,gemm,cutlass_tensorop_f16_s884gemm_f16_256x128_32x2_nt_align8,passed,success,universal,serial,256,8,2,f16:column,f16:row,f16:column,1,0,1,1,tensorop,f32,256,128,32,1,1,1,2,4,2,1,16,16,4,70,75,5152,12288,2,0.0107008,0.448394,1.14833
218,CUTLASS,gemm,cutlass_tensorop_s884gemm_f16_256x128_32x2_nt_align8,passed,success,universal,serial,512,8,2,f16:column,f16:row,f32:column,1,0,1,1,tensorop,f32,256,128,32,1,1,1,2,4,2,1,16,16,4,70,75,18464,24576,1,0.00950272,1.80958,2.58621
218,CUTLASS,gemm,cutlass_tensorop_f16_s884gemm_f16_256x128_32x2_nt_align8,passed,success,universal,serial,512,8,2,f16:column,f16:row,f16:column,1,0,1,1,tensorop,f32,256,128,32,1,1,1,2,4,2,1,16,16,4,70,75,10272,24576,2,0.010711,0.893148,2.29445
219,CUTLASS,gemm,cutlass_tensorop_s884gemm_f16_256x128_32x2_nt_align8,passed,success,universal,serial,1024,8,2,f16:column,f16:row,f32:column,1,0,1,1,tensorop,f32,256,128,32,1,1,1,2,4,2,1,16,16,4,70,75,36896,49152,1,0.00940032,3.65542,5.22876
219,CUTLASS,gemm,cutlass_tensorop_f16_s884gemm_f16_256x128_32x2_nt_align8,passed,success,universal,serial,1024,8,2,f16:column,f16:row,f16:column,1,0,1,1,tensorop,f32,256,128,32,1,1,1,2,4,2,1,16,16,4,70,75,20512,49152,2,0.010711,1.78351,4.58891
220,CUTLASS,gemm,cutlass_tensorop_s884gemm_f16_256x128_32x2_nt_align8,passed,success,universal,serial,2048,8,2,f16:column,f16:row,f32:column,1,0,1,1,tensorop,f32,256,128,32,1,1,1,2,4,2,1,16,16,4,70,75,73760,98304,1,0.00943104,7.28386,10.4235
220,CUTLASS,gemm,cutlass_tensorop_f16_s884gemm_f16_256x128_32x2_nt_align8,passed,success,universal,serial,2048,8,2,f16:column,f16:row,f16:column,1,0,1,1,tensorop,f32,256,128,32,1,1,1,2,4,2,1,16,16,4,70,75,40992,98304,2,0.0107213,3.56084,9.16905
221,CUTLASS,gemm,cutlass_tensorop_s884gemm_f16_256x128_32x2_nt_align8,passed,success,universal,serial,4096,8,2,f16:column,f16:row,f32:column,1,0,1,1,tensorop,f32,256,128,32,1,1,1,2,4,2,1,16,16,4,70,75,147488,196608,1,0.00948224,14.4859,20.7343
221,CUTLASS,gemm,cutlass_tensorop_f16_s884gemm_f16_256x128_32x2_nt_align8,passed,success,universal,serial,4096,8,2,f16:column,f16:row,f16:column,1,0,1,1,tensorop,f32,256,128,32,1,1,1,2,4,2,1,16,16,4,70,75,81952,196608,2,0.0107315,7.11211,18.3206
225,CUTLASS,gemm,cutlass_tensorop_s884gemm_f16_256x128_32x2_nt_align8,passed,success,universal,serial,8,16,2,f16:column,f16:row,f32:column,1,0,1,1,tensorop,f32,256,128,32,1,1,1,2,4,2,1,16,16,4,70,75,608,768,1,0.00932864,0.0606995,0.0823271
225,CUTLASS,gemm,cutlass_tensorop_f16_s884gemm_f16_256x128_32x2_nt_align8,passed,success,universal,serial,8,16,2,f16:column,f16:row,f16:column,1,0,1,1,tensorop,f32,256,128,32,1,1,1,2,4,2,1,16,16,4,70,75,352,768,2,0.0106906,0.030665,0.0718391
226,CUTLASS,gemm,cutlass_tensorop_s884gemm_f16_256x128_32x2_nt_align8,passed,success,universal,serial,16,16,2,f16:column,f16:row,f32:column,1,0,1,1,tensorop,f32,256,128,32,1,1,1,2,4,2,1,16,16,4,70,75,1152,1536,1,0.00933888,0.114884,0.164474
226,CUTLASS,gemm,cutlass_tensorop_f16_s884gemm_f16_256x128_32x2_nt_align8,passed,success,universal,serial,16,16,2,f16:column,f16:row,f16:column,1,0,1,1,tensorop,f32,256,128,32,1,1,1,2,4,2,1,16,16,4,70,75,640,1536,2,0.0106906,0.0557545,0.143678
227,CUTLASS,gemm,cutlass_tensorop_s884gemm_f16_256x128_32x2_nt_align8,passed,success,universal,serial,32,16,2,f16:column,f16:row,f32:column,1,0,1,1,tensorop,f32,256,128,32,1,1,1,2,4,2,1,16,16,4,70,75,2240,3072,1,0.00932864,0.22363,0.329308
227,CUTLASS,gemm,cutlass_tensorop_f16_s884gemm_f16_256x128_32x2_nt_align8,passed,success,universal,serial,32,16,2,f16:column,f16:row,f16:column,1,0,1,1,tensorop,f32,256,128,32,1,1,1,2,4,2,1,16,16,4,70,75,1216,3072,2,0.0106803,0.106035,0.287632
228,CUTLASS,gemm,cutlass_tensorop_s884gemm_f16_256x128_32x2_nt_align8,passed,success,universal,serial,64,16,2,f16:column,f16:row,f32:column,1,0,1,1,tensorop,f32,256,128,32,1,1,1,2,4,2,1,16,16,4,70,75,4416,6144,1,0.00943104,0.436083,0.651466
228,CUTLASS,gemm,cutlass_tensorop_f16_s884gemm_f16_256x128_32x2_nt_align8,passed,success,universal,serial,64,16,2,f16:column,f16:row,f16:column,1,0,1,1,tensorop,f32,256,128,32,1,1,1,2,4,2,1,16,16,4,70,75,2368,6144,2,0.0106906,0.206292,0.574713
229,CUTLASS,gemm,cutlass_tensorop_s884gemm_f16_256x128_32x2_nt_align8,passed,success,universal,serial,128,16,2,f16:column,f16:row,f32:column,1,0,1,1,tensorop,f32,256,128,32,1,1,1,2,4,2,1,16,16,4,70,75,8768,12288,1,0.00953344,0.856547,1.28894
229,CUTLASS,gemm,cutlass_tensorop_f16_s884gemm_f16_256x128_32x2_nt_align8,passed,success,universal,serial,128,16,2,f16:column,f16:row,f16:column,1,0,1,1,tensorop,f32,256,128,32,1,1,1,2,4,2,1,16,16,4,70,75,4672,12288,2,0.0107008,0.406618,1.14833
230,CUTLASS,gemm,cutlass_tensorop_s884gemm_f16_256x128_32x2_nt_align8,passed,success,universal,serial,256,16,2,f16:column,f16:row,f32:column,1,0,1,1,tensorop,f32,256,128,32,1,1,1,2,4,2,1,16,16,4,70,75,17472,24576,1,0.00953344,1.70684,2.57787
230,CUTLASS,gemm,cutlass_tensorop_f16_s884gemm_f16_256x128_32x2_nt_align8,passed,success,universal,serial,256,16,2,f16:column,f16:row,f16:column,1,0,1,1,tensorop,f32,256,128,32,1,1,1,2,4,2,1,16,16,4,70,75,9280,24576,2,0.0106803,0.809215,2.30105
231,CUTLASS,gemm,cutlass_tensorop_s884gemm_f16_256x128_32x2_nt_align8,passed,success,universal,serial,512,16,2,f16:column,f16:row,f32:column,1,0,1,1,tensorop,f32,256,128,32,1,1,1,2,4,2,1,16,16,4,70,75,34880,49152,1,0.00954368,3.40377,5.15021
231,CUTLASS,gemm,cutlass_tensorop_f16_s884gemm_f16_256x128_32x2_nt_align8,passed,success,universal,serial,512,16,2,f16:column,f16:row,f16:column,1,0,1,1,tensorop,f32,256,128,32,1,1,1,2,4,2,1,16,16,4,70,75,18496,49152,2,0.0107418,1.60362,4.57579
232,CUTLASS,gemm,cutlass_tensorop_s884gemm_f16_256x128_32x2_nt_align8,passed,success,universal,serial,1024,16,2,f16:column,f16:row,f32:column,1,0,1,1,tensorop,f32,256,128,32,1,1,1,2,4,2,1,16,16,4,70,75,69696,98304,1,0.0095232,6.81593,10.3226
232,CUTLASS,gemm,cutlass_tensorop_f16_s884gemm_f16_256x128_32x2_nt_align8,passed,success,universal,serial,1024,16,2,f16:column,f16:row,f16:column,1,0,1,1,tensorop,f32,256,128,32,1,1,1,2,4,2,1,16,16,4,70,75,36928,98304,2,0.0107213,3.20781,9.16905
233,CUTLASS,gemm,cutlass_tensorop_s884gemm_f16_256x128_32x2_nt_align8,passed,success,universal,serial,2048,16,2,f16:column,f16:row,f32:column,1,0,1,1,tensorop,f32,256,128,32,1,1,1,2,4,2,1,16,16,4,70,75,139328,196608,1,0.00953344,13.611,20.623
233,CUTLASS,gemm,cutlass_tensorop_f16_s884gemm_f16_256x128_32x2_nt_align8,passed,success,universal,serial,2048,16,2,f16:column,f16:row,f16:column,1,0,1,1,tensorop,f32,256,128,32,1,1,1,2,4,2,1,16,16,4,70,75,73792,196608,2,0.010752,6.39176,18.2857
234,CUTLASS,gemm,cutlass_tensorop_s884gemm_f16_256x128_32x2_nt_align8,passed,success,universal,serial,4096,16,2,f16:column,f16:row,f32:column,1,0,1,1,tensorop,f32,256,128,32,1,1,1,2,4,2,1,16,16,4,70,75,278592,393216,1,0.00956416,27.1283,41.1135
234,CUTLASS,gemm,cutlass_tensorop_f16_s884gemm_f16_256x128_32x2_nt_align8,passed,success,universal,serial,4096,16,2,f16:column,f16:row,f16:column,1,0,1,1,tensorop,f32,256,128,32,1,1,1,2,4,2,1,16,16,4,70,75,147520,393216,2,0.0108237,12.6933,36.3292
238,CUTLASS,gemm,cutlass_tensorop_s884gemm_f16_256x128_32x2_nt_align8,passed,success,universal,serial,8,32,2,f16:column,f16:row,f32:column,1,0,1,1,tensorop,f32,256,128,32,1,1,1,2,4,2,1,16,16,4,70,75,1184,1536,1,0.00932864,0.118204,0.164654
238,CUTLASS,gemm,cutlass_tensorop_f16_s884gemm_f16_256x128_32x2_nt_align8,passed,success,universal,serial,8,32,2,f16:column,f16:row,f16:column,1,0,1,1,tensorop,f32,256,128,32,1,1,1,2,4,2,1,16,16,4,70,75,672,1536,2,0.0106803,0.0585983,0.143816
239,CUTLASS,gemm,cutlass_tensorop_s884gemm_f16_256x128_32x2_nt_align8,passed,success,universal,serial,16,32,2,f16:column,f16:row,f32:column,1,0,1,1,tensorop,f32,256,128,32,1,1,1,2,4,2,1,16,16,4,70,75,2240,3072,1,0.0093184,0.223876,0.32967
239,CUTLASS,gemm,cutlass_tensorop_f16_s884gemm_f16_256x128_32x2_nt_align8,passed,success,universal,serial,16,32,2,f16:column,f16:row,f16:column,1,0,1,1,tensorop,f32,256,128,32,1,1,1,2,4,2,1,16,16,4,70,75,1216,3072,2,0.0106906,0.105933,0.287356
240,CUTLASS,gemm,cutlass_tensorop_s884gemm_f16_256x128_32x2_nt_align8,passed,success,universal,serial,32,32,2,f16:column,f16:row,f32:column,1,0,1,1,tensorop,f32,256,128,32,1,1,1,2,4,2,1,16,16,4,70,75,4352,6144,1,0.00937984,0.432109,0.655022
240,CUTLASS,gemm,cutlass_tensorop_f16_s884gemm_f16_256x128_32x2_nt_align8,passed,success,universal,serial,32,32,2,f16:column,f16:row,f16:column,1,0,1,1,tensorop,f32,256,128,32,1,1,1,2,4,2,1,16,16,4,70,75,2304,6144,2,0.0106906,0.200716,0.574713
241,CUTLASS,gemm,cutlass_tensorop_s884gemm_f16_256x128_32x2_nt_align8,passed,success,universal,serial,64,32,2,f16:column,f16:row,f32:column,1,0,1,1,tensorop,f32,256,128,32,1,1,1,2,4,2,1,16,16,4,70,75,8576,12288,1,0.0095232,0.838691,1.29032
241,CUTLASS,gemm,cutlass_tensorop_f16_s884gemm_f16_256x128_32x2_nt_align8,passed,success,universal,serial,64,32,2,f16:column,f16:row,f16:column,1,0,1,1,tensorop,f32,256,128,32,1,1,1,2,4,2,1,16,16,4,70,75,4480,12288,2,0.0106906,0.390281,1.14943
242,CUTLASS,gemm,cutlass_tensorop_s884gemm_f16_256x128_32x2_nt_align8,passed,success,universal,serial,128,32,2,f16:column,f16:row,f32:column,1,0,1,1,tensorop,f32,256,128,32,1,1,1,2,4,2,1,16,16,4,70,75,17024,24576,1,0.00954368,1.66129,2.57511
242,CUTLASS,gemm,cutlass_tensorop_f16_s884gemm_f16_256x128_32x2_nt_align8,passed,success,universal,serial,128,32,2,f16:column,f16:row,f16:column,1,0,1,1,tensorop,f32,256,128,32,1,1,1,2,4,2,1,16,16,4,70,75,8832,24576,2,0.0108646,0.757084,2.26202
243,CUTLASS,gemm,cutlass_tensorop_s884gemm_f16_256x128_32x2_nt_align8,passed,success,universal,serial,256,32,2,f16:column,f16:row,f32:column,1,0,1,1,tensorop,f32,256,128,32,1,1,1,2,4,2,1,16,16,4,70,75,33920,49152,1,0.00955392,3.30654,5.14469
243,CUTLASS,gemm,cutlass_tensorop_f16_s884gemm_f16_256x128_32x2_nt_align8,passed,success,universal,serial,256,32,2,f16:column,f16:row,f16:column,1,0,1,1,tensorop,f32,256,128,32,1,1,1,2,4,2,1,16,16,4,70,75,17536,49152,2,0.0108544,1.50461,4.5283
244,CUTLASS,gemm,cutlass_tensorop_s884gemm_f16_256x128_32x2_nt_align8,passed,success,universal,serial,512,32,2,f16:column,f16:row,f32:column,1,0,1,1,tensorop,f32,256,128,32,1,1,1,2,4,2,1,16,16,4,70,75,67712,98304,1,0.00954368,6.60769,10.3004
244,CUTLASS,gemm,cutlass_tensorop_f16_s884gemm_f16_256x128_32x2_nt_align8,passed,success,universal,serial,512,32,2,f16:column,f16:row,f16:column,1,0,1,1,tensorop,f32,256,128,32,1,1,1,2,4,2,1,16,16,4,70,75,34944,98304,2,0.0109056,2.98417,9.01408
245,CUTLASS,gemm,cutlass_tensorop_s884gemm_f16_256x128_32x2_nt_align8,passed,success,universal,serial,1024,32,2,f16:column,f16:row,f32:column,1,0,1,1,tensorop,f32,256,128,32,1,1,1,2,4,2,1,16,16,4,70,75,135296,196608,1,0.00956416,13.1746,20.5567
245,CUTLASS,gemm,cutlass_tensorop_f16_s884gemm_f16_256x128_32x2_nt_align8,passed,success,universal,serial,1024,32,2,f16:column,f16:row,f16:column,1,0,1,1,tensorop,f32,256,128,32,1,1,1,2,4,2,1,16,16,4,70,75,69760,196608,2,0.0108442,5.99116,18.1303
246,CUTLASS,gemm,cutlass_tensorop_s884gemm_f16_256x128_32x2_nt_align8,passed,success,universal,serial,2048,32,2,f16:column,f16:row,f32:column,1,0,1,1,tensorop,f32,256,128,32,1,1,1,2,4,2,1,16,16,4,70,75,270464,393216,1,0.0095744,26.3086,41.0695
246,CUTLASS,gemm,cutlass_tensorop_f16_s884gemm_f16_256x128_32x2_nt_align8,passed,success,universal,serial,2048,32,2,f16:column,f16:row,f16:column,1,0,1,1,tensorop,f32,256,128,32,1,1,1,2,4,2,1,16,16,4,70,75,139392,393216,2,0.0108134,12.0053,36.3636
247,CUTLASS,gemm,cutlass_tensorop_s884gemm_f16_256x128_32x2_nt_align8,passed,success,universal,serial,4096,32,2,f16:column,f16:row,f32:column,1,0,1,1,tensorop,f32,256,128,32,1,1,1,2,4,2,1,16,16,4,70,75,540800,786432,1,0.00960512,52.4365,81.8763
247,CUTLASS,gemm,cutlass_tensorop_f16_s884gemm_f16_256x128_32x2_nt_align8,passed,success,universal,serial,4096,32,2,f16:column,f16:row,f16:column,1,0,1,1,tensorop,f32,256,128,32,1,1,1,2,4,2,1,16,16,4,70,75,278656,786432,2,0.0108749,23.864,72.3164
